Unnamed: 0,User_Id,product_Id,title,category,rating,price,description,image
758,5367,8b6805ce6eb0a798f84bdda0be0977a6,Mudpuppy Unicorn Magic to Go Puzzle 36 Pieces Ages 3 TravelFriendly Bag Made with Safe NonToxic Materials,Toys & Games ,2,$9.99,36PIECE PUZZLE The 36piece Unicorn Magic to Go Puzzle is perfect for children ages 3 and older The pieces are extra thick and sturdy so its easy for small hands to manipulate The finished puzzle measures 12 x 9 and is phthalate free  BRIGHT UNICORN ARTWORK Does your child love unicorns Watch this puzzle bring a picture of two magical flying unicorns to life right before your eyes Join in the amazement with your little one as you build the puzzle together  TAKE IT WITH YOU Packaged in a travelfriendly drawstring pouch this puzzle fits perfectly on an airplane tray Bring it on family vacations for an alternative entertainment option for little ones  SAFE MATERIALS The Unicorn Magic to Go Puzzle greyboard contains 90 recycled paper the packaging contains 70 recycled paper and it is printed with nontoxic soybased inks  SCREENFREE FUN For over 25 years Mudpuppy has created quality nondigital puzzles games and toys for families that facilitate creative play and imaginative thinking All Mudpuppy products adhere to CPSIA ASTM and CE Safety Regulations,a
759,5311,ca04e499ad2209fc552cfe9c0f1159a8,Forum Novelties Childs Disco Costume Jumpsuit,Toys & Games ,4,$22.38,ZIP FRONT BLACK JUMPSUIT covered in flat silver sequins bell bottom legs and matching arm sleeves  SLEEVELESS ONEPIECE with collared neckline and silver trim pull on elbow length sleevettes with finger loop to secure while wearing  READ BEFORE BUYING Costumes are not sized the same as apparel review FORUMS CHILD SIZE CHART IN IMAGES reviews and Q  A for best fit do not choose based on clothing size  Forum offers a variety of DISCO THEMED costumes in styles and sizes for group and family dress up fun  FORUM NOVELTIES has been providing quality costumes and accessories for more than 30 years from frightening to funny Forum has it all,a
760,5032,9080830693aff4fe1019c51325a6ea5a,Plum Azur Lane Ijn Yamashiro 1 7 Scale PVC Figure Multicolor,Toys & Games ,4,$115.00,An import from Plum  From the Chinese smartphone game  Yamashiro is brought to life in her Kai retrofit form  Adorable catlike pose and big smile match her official art from the game  Special care has been paid to her human and ship parts alike,a
761,5124,13a9b31c88f9eb8b19c949980de5a5aa,Battat  Light  Sound School Bus  School Bus Toy Vehicle for Toddlers 18 Months  6Pc,Toys & Games ,4,$18.25,Bright yellow school bus toy for kids Includes bus driver and 4 Miniature passenger figurines  Fun features working headlights realistic engine idling honking horn and passenger sounds  Stop sign and passenger ramp fold in and out  Sturdy design and a classic look Made with soft rounded edges Perfect for tiny hands to grab and hold  Worryfree Battat toys are made responsibly with safe durable plastic  Imaginary play toys for kids encourage creative roll playing help develop social skills and improve motor skills  Dimensions this toddler vehicle measures 110 L x 55 W x 625 H inches approximately  3 AA batteries included  Age school bus is recommended for toddlers 18 months and up  Trustworthy Battat a familyowned company established in 1897,a
762,5205,bc4b1284a25486a4e25cdfe77f23ec25,Shrinky Dinks Shrinky Dinks DIY Keepsakes Project Pack Kids Art and Craft Activity,Toys & Games ,4,$10.00,Color bake and shrink something memorable  Make custom cards Keychains frames and more  Follow project directions or make something totally unique  Includes 6 Shrinky Dinks sheets traceable art decals key chains jump rings sticky gems and instructions  Recommended for children 6 years of age and older,a
763,5413,3bf26ff5b8dfb6d7101aaf98d9bdf7ba,Edushape Mini Golf Garden Party Game,Toys & Games ,2,$33.99,Gross Motor Skills  Socialization  Logic  Reasoning  HandEye Coordination  Visual Sensory Development,a
764,5176,ea5373e6ca7e332d117a59f9fc5301da,Green Toys Fire Engine,Toys & Games ,5,$11.72,Made in the USA  100 recycled plastic  No BPA phthalates or PVC,a
765,5010,5904074c7d9e3a8895da7786301cf38c,Pop A Zit Game,Toys & Games ,4,$18.99,Fun  Gross Gameplay  Two ways to play use with included water bottle to spray water up to 6 Feet or use the included adapter to work with Spray String not included  Spin the dial squeeze the zit blast water or spray string  Contents 1 Pop A Zit game board 1 water bottle 1 spinner 1 spray string adapter  For ages 4 Family gameplay for 2 players,a
766,5540,bbdcf06ce9c516469c52de2296a340f2,hand2mind STEM in Action Coding Robot Mouse Classroom Set Learning Activities Exploring Basic Needs of Animal As Students Code  Program Life Science Lesson STEMorg Authenticated,Toys & Games ,4,$255.86,Students explore the basic needs of animals as they design a code for a programmable mouse to demonstrate their knowledge of everything a mouse needs to survive  Help students build essential skills such as following code writing code and debugging code  Students work through the Engineering Design Process to learn the value of rethinking and support multiple solutions  STEM in Action modules are the easytoimplement PreK5 solution for integrating science math literacy and engineering skills into realworld problems  INCLUDES 3 Jack the Robot Mouse with Coding Cards and Activity Guide Activity Book Teacher Guide Mouse postergame batteries 3 Sets of additional coding cards and parts to create the maze,a
767,5038,de676f54e914cc580fc8c5973e8fc0f0,HANSA Burrowing Owl Plush,Toys & Games ,3,$35.44,HANSA  Burrowing Owl Plush Toy  Teaching tag includes information on habitat lifestyle eating habits and more  Completely hand sculpted with a hand finished face  Hand cut custom designed fabric,a
768,5482,732d5c51f07d651b2072def656bd6093,Whitmor Kids Canvas Collapsible Cube10 x 10 x 10 inches Pink Owl Collection,Home & Kitchen ,2,$12.51,Durable canvas construction with felt animal appliqu  Fits great inside wood or wire storage cubes folds flat for easy storage when not in use  Perfect size to store toys and books or to organize clothing and accessories  Dimensions 10 L x 10 W x 10 H inches  Attractive playful design compliments your childs bedroom or play area  Folds flat for easy storage when not in use Bottom of cube pulls upward and walls fold on top of each other into a very thin flat profile for easy storage  A perfect addition to playrooms bedrooms classrooms and more Each playful eyecatching design adds a touch of fun to any room  For over 70 years Whitmor has been bringing organization home If you have questions or problems please contact us for immediate assistance,a
769,5216,a061473e1b146bd8eae72570f3cfe8ff,WWE Wrestlemania Elite Kevin Owens Figure,Toys & Games ,5,$19.91,Capture the blowout action with this WWE Elite Collection 6inch WrestleMania figure  This bold and colorful figure comes ready to wreak havoc right out of the box featuring one of the WWEs biggest WrestleMania personalities and champions  Figure features deluxe articulation a detailed character expression authentic ring attire and iconic accessories  Get all the WWE WrestleMania Elite Collection figures and let the WrestleMania battles begin  Great gift fro WWE fans,a
770,5410,b75a5c14b4d4c3c6a7b36a9754e54d14,Enchantimals Huggable Cuties Felicity Fox Doll  Flick Figure,Toys & Games ,5,$19.99,The Enchantimals Huggable Cuties dolls and their animalbesties are inspired by the world of Enchantimals a magical place nestled deep in nature  Felicity Fox doll shares a special bond with her animalbestie Flick fox theyre always together and they look alike too  Felicity Fox doll is designed in 12inch scale for huggable fun Kids will love the bigger details  Felicity Fox is wearing a bright orange bodice and removable skirt with vibrant flower and animal prints Pink shoes finish the look  She has enchanting touches to match her animalbestie Flick like fox ears a furry tail and foxinspired facial features Flick fox is so charming with a furry tuft of white hair and pink paws,a
771,5232,b68ad9cbd748c66fd3811ccee19a91ef,Zvezda 7027  Airliner Boeing 737700C40B  Plastic Model Kit Scale 1144 109 Parts Lenght 9,Toys & Games ,3,$26.58,Plastic  Scale 1 144 Number of parts  109 Material  Unpainted plastic  Paint tools and glue are not included  Length of the assembled model  9  All assembly instructions are in pictures only  Necessary tools for assembly sprue cutter long nose pliers small files pin vise  scissors side cutters Tweezers Modeling knife,a
772,5261,dc1855caea4c65e837576f848cda1ef5,Amscan Party Supplies Sparkling Celebration 30th Birthday 9 Round Prismatic Plates  8 count,Toys & Games ,5,$4.56,8 in a package  Package Length 1110  Package Width 1110  Package Height 48,a
773,5438,9bbba85ef78707b297b609dea181b164,Folkmanis Polar Bear Cub Hand Puppet,Toys & Games ,2,$30.59,Easily animate the antics of this engaging Polar Bear Cub hand puppet with soft plush fur  Ideal for stage and puppet theater storytelling teaching daycare preschool pretend play roleplaying presentations games parties and gifts  Your hand controls the mouth and expressions of this sociable animal puppet  Constructed from highquality materials with exceptionally realistic details easy to care for years of play  Comfortably slips over the hand measures 14 x 8 x 7 inches LxWxH,a
774,5386,624290f7a9ea32ac6d2e1e0c30bd36e0,Power Trains Car Pack Space,Toys & Games ,2,$9.99,Car Packs features authentic train look with real details and themes  Each car pack can work on and off the track Featuring 4 different styles to choose from  Match the theme to a corresponding Power Trains Engine Pack to form a complete themed train  Collect Connect  Expand your Power Trains world,a
775,5083,ea5c9c223405080d4e865874e5397333,Pacific Play Tents TriColor Dome Tent and Tunnel 2 Piece Bundle 48 x 48 x 42 Tent and 6 Foot Tunnel,Toys & Games ,1,$67.69,Tent size 48 X 48 X 42 high Mesh panels provide ventilation and easy viewing for supervision  Tunnel size 6 ft x 19 inch  Tunnel collapses flat for easy storage and portability  Encourages physical play and stimulates the imagination at any time of day or night  Large enough to accommodate friends toys and kid sized furniture  Easily wipes clean with a damp cloth and mild soap  indoor or outdoor use,a
776,5325,8109adf8e72fe439c4e78373cf4e7932,Great Eastern Entertainment Sonic The Hedgehog Sonic  Amy Hinge Wallet,Toys & Games ,4,$16.36,Fully Licensed  Quality Materials  Perfect Gift for Anime Lovers,a
777,5242,514378d28d95b71ea2d446219b51a4c9,Precious Moments Dolls by The Doll Maker Linda Rick A Small Child Shall Lead Them 12 inch Doll,Toys & Games ,3,$49.70,And A Small Child Shall Lead them This incredible doll comes with her favorite animal friends including a elephant giraffe lion horse bunny and duck  All vinyl doll created with the finest materials  Once upon a time there was a doll made just for you Designed by Linda Rick The Doll Maker  Officially licensed Precious Moments Doll,a
778,5294,9a44b870a0089070f78303e493f74806,Scalextric Jaguar E Type Union Jack 132 Slot Race Car C3878,Toys & Games ,4,$39.99,Car is highly detailed with full interior and racer  Car has working Xenon Effect Headlights and working tail lights  Easy change braid with magnatraction  Compatible with all 132nd Scale Analog Slot Car Race Tracks,a
779,5435,a8f94130b00d8d15fdace9c10fff3143,HydroTools by Swimline Clear Weighted Triangle Pool Vacuum Head,"Patio, Lawn & Garden ",5,$20.85,Weighted vacuum head for pool cleaning  Designed for fiberglass and vinyllined pools  Triangular shape is ideal for cleaning pool corners thoroughly  Angled brushes for quick pickup of debris  Fits standard 114inch and 112inch vacuum hoses SnapAdapt handle for easy assembly,a
780,5253,d6d4334f93c958b891ae2fb5cdd6949f,Lamaze Disney Lion King Clip  Go Simba Baby Toy,Toys & Games ,4,$15.11,Simba features bright colors and contrasting patterns for visual stimulation  His roaring sound and chewy tail encourage auditory and tactile skills  Designed to be easy for little hands to grip promotes fine motor skills  Surprise crinkles and interesting textures for baby to explore  Lamaze onthego clip hooks to strollers carriers and diaper bags for easy fun where ever you go,a
781,5024,e133f0c3142423bf13dccc315ad2bde8,Rubies DC Superheroes Tutu Skirt,"Clothing, Shoes & Jewelry ",1,$25.95,100 Polyester  Imported  Pull On closure  Hand Wash  07 high  14 wide  Officially licensed DC Comics adult tutu skirt look for trademark on label and packaging to help assure youve received an authentic safetytested item  Pullon tutu skirt yellow elastic waistband with Wonder Woman logo blue tulle skirt with white stars  ONE SIZE Designed to fit up to womens size 8  Pair with other DC Superhero separates search for leggings long sleeve tops hoodies corset tops gauntlets tights and more  Familyowned familyfocused and based in the USA since 1951 Rubies has classic and licensed costumes and accessories in sizes and styles for your entire family,a
782,5091,b211c1b4e0845807da58425ba9b40e62,Rubiks Cage Game HeadtoHead Brain Teaser Strategy Game Based On The RubikS Cube for Ages 7  Up,Toys & Games ,5,$9.99,Rubiks cage is the multiplayer multiplane challenge sure to confound even the very best Rubiks solvers  On a turn players can insert a cubie turn a level of the cage or flip the entire cage  The first player with three of the same color cubies in a row wins  The game Comes with the Rubiks cage and 24 cubies  Can your strategy out Smart your opponent Plan you moves like chess to win,a
783,5244,93ada703afc7b7b04f796f088630143c,FanWraps Fallout 4 VaultTec Weathered Tin Tote Replica,Home & Kitchen ,5,$15.99,AntiRust Coating  FullColor Printing  Licensed and Authentic,a
784,5142,08250dcbada4cd9dd72368b174c6d0b4,Rubies Costume Co Womens Teenage Mutant Ninja Turtles Classic Michelangelo Eye Mask Orange One Size,"Clothing, Shoes & Jewelry ",5,$5.37,100 Polyester  Imported  Hand Wash  886 high  098 wide  Sabine wrens printed jumpsuit with attached boot tops  Belt and mask included  Available in sizes s dress 6 to 10 m 10 to 14 and l dress 14 to 16  Officially licensed star wars rebels costume  With star wars costumes in every size and style Rubies is the perfect place for your group or family costume needs  Sabine wrens printed jumpsuit with attached boot tops  Belt and mask included  Available in sizes s dress 6 to 10 m 10 to 14 and l dress 14 to 16  Officially licensed star wars rebels costume  With star wars costumes in every size and style Rubies is the perfect place for your group or family costume needs,a
785,5583,754e9101ec37ebdf7dc3f44f74a6afe0,Daron Worldwide Trading Postage Stamp USN E2C Hawkeye 1145 Vaw116 Sun K Airplane Model,Toys & Games ,4,$22.89,Diecast metal historical airplane  Includes display stand  Part of the Postage Stamp collection,a
786,5339,1f890ec1f6e59fc7844045aa03fcd4c8,Aurora World 18 Princess Sparkles  Angela Multicolor,Toys & Games ,2,$18.99,18 inches in size  High quality materials make for a soft and fluffy touch  Bean filled to ensure stability and quality  Mylar material makes for realistic and soft hair that you can comb  Embroidered facial features,a
787,5216,66fdb1cb810f2f3dc58a9eabb05f5036,Whitmor Frog Collapsible Cube,Home & Kitchen ,5,$9.28,Assemble in seconds  Polypropylene nonwoven fabriccovered body with clear vinyl window  Clear mouth with magnetic closure for easy access  Dimensions 10 x 10 x 10 inches  Collapsible and easy to store the bottom of cube pulls upward and walls fold on top of each other into a very thin flat profile for easy storage  Sturdy reinforced thick cardboard walls for longlasting storage  Perfect for organization of toys books sports equipment linens clothing etc  For over 70 years Whitmor has been bringing organization home If you have questions or problems please contact us for immediate assistance,a
788,5365,2709f23df9a9c200bbedc815ae162d08,Smugglers Family Board Game,Toys & Games ,4,$31.32,A funny family game for 24 players  By Klaus and Benjamin Teuber creators of Settlers of Catan Dohdles Barbarossa and Tumult Royale  The player who collects the most contraband items wins the game  Recommended for ages 8 40 minute play time  Who will be the best at getting the goods,a
789,5063,aa6089e31824b72cad6fddaa2d06fb28,Late for the Sky Bostonopoly,Toys & Games ,3,$19.95,For 26 Players  Choose traditional play or one hour version  Opolystyle play  For 26 players  Choose Traditional Play or 1hour version  Opolystyle play  Family Fun  Learn all about the city,a
790,5443,9b3c0ad33fe5741674a00da94c29f926,FisherPrice Thomas  Friends Wooden Railway Deluxe OverTheTrack Signal  Battery Operated,Toys & Games ,2,$31.19,Keep train traffic rolling smoothly with the deluxe over the track Signal  Slide levers activate traffic lights  Green means go and red means stop  Works great with any Thomas and Friends Wooden Railway set  Expand your world of Thomas and Friends and create your very own Thomas adventures,a
791,5445,cce39cc11d3af888f8d79ed2842acf45,Wonder Crew Superhero Buddy  Marco,Toys & Games ,5,$19.96,Wonder crew combines the adventure of an action figure with the emotional connection of a stuffed animal to give children a best friend  The 15 buddy has a smooth vinyl head arms and legs and a soft huggable body  Marco comes dressed as a superhero with a cape and mask  Also includes a matching cape and mask for the child to wear on their adventures  For ages 3 and up,a
792,5225,56d493aa1dffc6c8c623d0e42d66f991,Uncanny Brands Star Wars Darth Vader Elite 2Slice Toaster Star Wars Icon Logo onto Your Toast,Home & Kitchen ,1,$42.99,BRING THE DARK LORD INTO YOUR KITCHEN  Vaders infamous helmet is a detailed working toaster  TOASTS STAR WARS ICONIC LOGO ON YOUR BREAD  When the toast pops up Star Wars logo appears on each slice Adjustable dial lets you enjoy your toast on the Dark Side  STRIKING ON YOUR COUNTERTOP  A great conversation starter and sure to be noticed  FOR THE ULTIMATE STAR WARS FAN  Get one for the Star Wars and Darth Vader enthusiast in your life This toaster officially licensed by the Star Wars  PRODUCT SPECS Toasts Bread Waffles English Muffins or Toaster Pastry Compact TwoSlice Toaster with CoolTouch Housing Reheat Defrost and Quick Stop Function Adjustable Thermostat Automatic Manual SwitchOff,a
793,5402,d80f24a2d6d94055fa07a5f4ae81d7c8,Snuggie Tails Allstar Innovations Mermaid Blanket for Kids Pink As Seen on TV,Home & Kitchen ,1,$17.99,80 Polyester 20 Pu  Imported   Simply slide in and TRANSFORM into an Enchanted Pink Mermaid while keeping warm cozy and cuddly   Made from ultrasoft comfy velveteen these wonderful characters tails are a blanket and sleeping bag at once making them perfect for lounging at home car rides outdoors or your next sleepover party   Look Mom No Hands The best part Snuggie Tails keep you warm and comfy while being totally hands free Play games text read eat and more without having to ever take it off   These adorable cuddle blankets are colorful promoting powerful play and creative imagination Available in a variety of Snuggly Styles Pink Mermaid and Blue Mermaid Gray Shark Clown Fish Rainbow Fish and Dolphin   Length 5400 Width 2795 of super soft velveteen machine washable snuggie fun,a
794,5542,b3a3b18773657261a7fdf8c76a706d40,PlayDoh E2930 Buzz n Cut Fuzzy Pumper Barber Shop Toy with Electric Buzzer and 5 NonToxic Colors 2Ounce Cans,Toys & Games ,5,$9.96,Sit your customer in the chair and turn the crank to grow hilarious hair then style them up One of the two characters can also grow a silly beard  Hear the sound whenever the buzzer touches PlayDoh compound Kids are going to love growing hair and shaving it all off again Buzzer requires 2 AAA batteries not included  A perfect gift for preschoolers this barber shop toy is sure to be a delight for girls and boys alike Its a great activity for kids who love arts and crafts like modeling clay  With 5 PlayDoh colors in 2ounce cans kids can create the most colorful hairstyles imaginable Also includes kidfriendly plastic scissors a brush and a razor to help them feel like real barbers,a
795,5239,e329aca09247a5959f1980d6ab66ad1c,GUND Jolly Santa Stuffed Plush 7,Toys & Games ,1,$12.93,SANTA PLUSH This 7 plush features a jolly Santa Claus with a cute sideways smile classic red suit  adorable oversized head Pair Santa with Rosey Claus  Chilly the Snowman for a festive scene  SOFT  HUGGABLE Made from a soft huggable material that meets famous GUND quality standards this plush toy features surfacewashable construction for easy cleaning Appropriate for ages 1  up  THE PERFECT GIFT Our plush dolls teddy bears  stuffed animals make perfect gifts for Christmas birthdays baby showers baptisms Easter Valentines Day  more A perfect gift for the holidays  QUALITY CUDDLES Known for our huggable plush designs  gifts our awardwinning bears  toys appeal to all ages from infants  toddlers to adults Theyre perfect for play collecting  cuddling  PREMIER PLUSH The oldest maker of soft toys in America  one of the first companies to produce a teddy bear GUND has been creating unique stuffed animals known for their quality for over 120 years,a
796,5340,f2580bcf05694d26e1725bc11d1464ad,Revell SnapTite 2017 Ford F150 Raptor Pick Up Truck Model Kit,Toys & Games ,1,$15.78,Easy snaptogether assembly no gluing or painting needed  This kit is modeled after the 2017 Ford F150 Raptor  Like most raptors its fully capable of taking on the highway downtown streets and muddy backwoods trackswherever the day goes the Raptor will take you there,a
797,5595,ad4941365a53d21f8b7745fe4a7577d7,MasterPieces Cruisin Route 66 Jigsaw Puzzle Phils Diner Featuring Art by Bruce Kaiser 1000 Pieces,Toys & Games ,4,$15.00,Classic cars cruising puzzle  1000 pieces in finished 1925 inch x 2675 inch puzzle  Read about artist Bruce Kaiser  collect the Cruisin series  MasterPieces  An American Puzzle  Game Company We stand behind our products and guarantee your satisfaction  Thick recycled puzzle board and random cut pieces ensure a tight interlocking fit and create a fun experience,a
798,5348,29b2140b891dfb955af3d84f27dd74f9,AMAV Sweet Tarts Ice Pops Maker Toy  DIY Make Real Popsicles  Best Activity for Friends to Do Together  Perfect Present for Kids Aged 4,Home & Kitchen ,2,$7.90,Diy ice pop factory create fresh and exciting designs to elevate your delicious treat and make your own sweet tart ice pops with this allinclusive DIY ice pops factory  Healthy alternative healthy summer snack use any liquid you want including milk yogurt fruits or any other juice to make a healthy alternative for snack time  Use as a healthy alternative for snack time when you use ingredients you can trust  Whats inside our popsicle stand comes with four slots to make four delicious ice pops that you can design with your favorite colors and flavors liquids bottle  Recommended for kids ages 4 and up,a
799,5366,adbb4cacfd5c3379a09226a880e7eae6,LEGO City Garage Center 60232 Building Kit New 2019 234 Pieces,Toys & Games ,4,$49.95,Build a busy toy garage separate gas station pump and car wash stands with lots of roleplay opportunities to take care of the different vehicles driving around the city LEGO 4 introduces your child to a wide range of recognizable places and people with easy building so they get right into the play  Includes 4 LEGO City minifigures Harl Hubbs a mechanic gas station worker and sports car driver  Sports car measures over 1inch 4cm high 3inch 9cm long and 1inch 4cm wide Tow truck measures over 2inch 6cm high 3inch 9cm long and 1inch 4cm wide Gas tanker measures over 1inch 5cm high 3inch 9cm long and 1inch 4cm wide Car wash measures over 3inch 10cm high 3inch 9cm wide and 3inch 9cm deep Garage measures over 4inch 11cm high 4inch 12cm wide and 4inch 11cm deep Gas station pump measures over 3inch 8cm high 4inch 12cm wide and 3inch 8cm deep  234 pieces  Kids toy for boys and girls aged 4 and for fans of LEGO toys and kids of all ages  This LEGO City Garage Center 60232 cool toy for kids makes a great gift for kids and can be built together with all other original LEGO sets and bricks for more creative play,a
800,5370,6b964629a56556fcffc1fd1a42d4affb,FisherPrice Little People Noahs Ark Frustration Free Packaging,Toys & Games ,2,$45.36,Frustration Free Packaging Easy to open 100 percent recyclable and less packaging waste  Toddlers can role play the classic story as they pretend to be different animals or even Noah himself  The Arks deck can be removed for play inside and easily pops back on to store everything inside  Includes 9 figures Noah and two elephants lions zebras and giraffes  Add more animals to Noahs ArkSold separately and subject to availability  Its a perfect way to help your child discover and recreate the classic storyor just have fun matching the animals The deck of the Ark easily removes for play inside,a
801,5392,6b29a73ef59f4495d1793780edd83a73,Disney Monsters Inc Mike Wazowski Round Decorative Pillow GreenGreenBlueWhite,Toys & Games ,1,$16.86,100 Polyester   Imported  This bright and playful Monsters Inc pillow measures 12 x 12 x 3 perfect to toss on a bed chair or rocker Makes a wonderful fun gift  This plush pillow is made of 100 Polyester Vela fabrics  Your little one will be all smiles with this fun and playful Monsters Inc Mike Wazowski lime green round pillow,a
