Unnamed: 0,User_Id,product_Id,title,category,rating,price,description,image
234,5429,c16b45bd9a78192f515943d6e9a0ce6e,Wild Republic Mountain Goat Plush Stuffed Animal Plush Toy Gifts for Kids Cuddlekins 8 Inches,Toys & Games ,3,$9.99,Go shout it from the mountaintops this Mountain goat stuffed animal by Wild Republic is ready to become a Part of the family  The fluffy white fur of this mountaindwelling plush toy protects against biting winds in the wild but is perfect for stuffed animal snuggles at home  Dont let its pristine fur stop you from going on Alpine adventures with your fuzzy friend every inch of this playful plush toy is surface washable  From the tips of the horns on its head to the pads of the hooves on its feet this realistic stuffed animal is 8 inches of frolicking and fun  Stuffed animal lovers of all ages will move mountains to get their hooves on this adorable Mountain goat stuffed animal,a
235,5384,9eb85128798f24fca126e4640b941417,SunStaches Costume Sunglasses Incredibles Edna Mode Glasses Party Favors UV400,Toys & Games ,2,$9.99,All SunStaches Sunglasses provide 100 UV400 protection and impact resistant lenses because we care  Instant party starter and very comfortable to wear  Great for kids and adults one size fits most  As seen on the popular show Shark Tank  Officially licensed product,a
236,5266,dea30d4ffebdef86db48683ea1eba3e1,AMERICAN GREETINGS Bright Colors Latex Balloons  Pack of 15  Party Decor,Toys & Games ,5,$5.00,15 balloons per pack  Each measures 12 when inflated  Latex balloons in six assorted bright colors Yellow Orange Red Purple Bright Royal Blue Kiwi Green  Guaranteed to make your party exciting and fun,a
237,5179,d49b828318fdd2a558f8009a4dddab7d,GreenBrier Games Yashima Legends from Fairytale Board Game,Toys & Games ,3,$35.00,Gives you everything you need to add two additional players to the base Yashima game  Also playable by itself as a two player standalone game  Adds four new Kami Masters and two new Kami offering up more abilities and strategies to the core game,a
238,5067,90f3d45ebaa97aabd593470630268c84,Bachmann Industries New Haven 50 Plug Door Box Car,Toys & Games ,2,$18.81,Metal wheels detailed underframe with separate brake rigging  Bodymounted EZ Mate Mark II couplers  N Scale 1160,a
239,5157,8b205983b35a7751fe26ac6a2bdf0fda,HARRY POTTER Collapsible Storage Cubes 2 Pack Red,Toys & Games ,1,$8.91,Features unique HARRY POTTER design and graphic  Instant organizer for toys books clothes and more  Reinforced carry handles make it easy to transport  Soft canvas material with structured frame that folds flat for easy storage when not in use  Includes a set of 2 10inch cubes,a
240,5282,40ba2b8894421bb803d20811e37e08bc,Animal Adventure  Popovers Travel Pillow  Orange Fox  Transforms from Character to Travel Pillow  13 x 85 x 6,Toys & Games ,2,$11.49,Special features crafted with a sturdy kidfriendly plastic zipper and a snap loop to adhere to any travel gear  Super soft each is made with ultrasoft plush and velour fabrics making it perfect for cuddling and playing  Easy to use both adults and kids can easily transform from character to travel pillow  Perfect popover size 13 D x 8 W x 6 H easy to handle and lightweight Perfect for kids 18 months and up  Spot clean damp cloth allows for an easy surface Wash,a
241,5523,fe89e1abfdd0674db0fcce601edff4a5,Plush Royal Crown purple Party Accessory 1 count 1Pkg,Toys & Games ,4,$8.99,This item is a great value  1 per package  Mardi Gras party item  Hats  Crowns for festive occasions  High Quality,a
242,5552,464420bbe766978dc412f3290f213fd2,WindUp Walking Families  Duck Family,Toys & Games ,3,$4.72,Easytomake with 3D Magic Dough nontoxic and no baking required  Creates one walking duck and two pullalong ducklings  Includes 9 pieces for ages 6 and up,a
243,5524,ae3b5b98ce5d15302ca627ccd64d43bf,Melissa  Doug Kids Furniture Wooden Table  4 Chairs White Table Pastel Pink Yellow Green Blue Chairs 205 H x 235 W x 20 L Great Girls and Boys  Best for 3 4 5 6 7 and 8 Year Olds,Toys & Games ,4,$143.99,Easytoassemble kids furniture set the Melissa  Doug wooden table and 4 chair set is an easytoassemble wooden table and chair set that is sized for kids ages 3 to 8  Great for screenfree play Our table and chair set is ideal for children to play games work on puzzles create arts and crafts enjoy real and pretend meals and more  Sturdy wooden furniture Melissa  Doug focuses on making highquality furniture sets for kids We have made this sturdy wooden table and chair set from durable wood The chairs hold up to 100 pounds  Gift for ages 3 to 8 the wooden table  4 chairs set makes an ideal gift for kids ages 3 to 8  The gold standard in childhood play for more than 30 years Melissa  Doug has created beautifully designed imagination and creativitysparking products that nbc news calls The gold standard in early childhood play  100 happiness guarantee We design Every toy to the highestquality standards and to nurture minds and hearts If your child is not inspired give us a call and well make it right Our phone number is on every product,a
244,5308,d5da00041b0702afee4d235142c67625,Bohnanza High Bohn Plus Bohnaparte Card Game,Toys & Games ,1,$10.44 $ 10 . 44,For 37 Players  4590 minute playing time  3 expansions in one box  Requires Bohnanza to play,a
245,5209,17f96f39eb7728be6910508a529710ea,Hey Play Kids Popup Sixsided Ball Pit Tent,Toys & Games ,2,$11.99,Easy to Use popup playpen  the sixsided playpen is bright and colorful and pops open for effortless Assembly  Crush proof nontoxic colorful balls  the included 200 balls are made of Phthalate free and crushproof plastic so they will hold up to the roughest of play without any toxicity   Netted storage bags for balls  the set Comes with two mesh storage bags with adjustable close to hold all 200 balls  this also makes for easy Transport   Product details  ball pit measures 35 across contains 6 sides measuring 15 tall and 21 wide  balls measure 25 in diameter  Satisfaction guaranteed  Hey Play is committed to providing consumers with the Absolute best price and value on our entire line of products,a
246,5591,ede3d4a0a98b7e0a5a8cea4240498c1d,DIAMOND SELECT TOYS Batman The Animated Series Ras Al Ghul Resin Bust Figure,Toys & Games ,1,$56.95,Based on the classic animated series  Stands approximately 6 resin bust  Pedestal base inspired by the architecture of Gotham city  Limited to only 3 000 pieces  Handnumbered fullcolor box with a Certificate of Authenticity,a
247,5129,35d0e484bbb4687112e52071376dde6b,Skywalker Trampolines 9x15 Blue Rectangle Spring Pad,Sports & Outdoors ,3,Total price:,SAFETY IS OUR 1 PRIORITY All our products are tested for safety and durability to meet or exceed all ASTM standards  MATERIAL High quality PVC Color Blue  FEATURES Weather and UV resistant high quality PVC spring pad Designed to cover your frame and springs for protection This pad comes in 2 L shaped sections for easy assembly  WARRANTY Genuine Skywalker Trampoline component 1 year limited warranty  MODEL COMPATIBILITY STRC915  NOTE Make sure you are buying the right size Genuine Component for your trampoline Your model number can be located on the underside of your jump mat on a white tag enclosure net tag or on your spring pad tag Check your model compatibility,a
248,5223,2e2d46cee23bf6e46bcfc3202be60176,Sticko 450188 Stickers Shimmery Stars,Toys & Games ,2,$1.89,From sticko  Offers an assortment of designs in a variety of materials sizes colors and shapes  Acid and lignin free,a
249,5483,896dda12412dc704c34b162e81eebf21,Step2 2in1 Toy Box  Art Lid  Plastic Toy  Art Storage Container Grey,Toys & Games ,1,$52.44,Make cleanup fun with your toddler This toy box is a perfect and colorful addition to any little ones play space or bedroom  Toy box organizer features a clip and art board lid to display masterpieces or to hold paper as your little one draws  This kids toy box is a great way to encourage toddlers and preschoolers to take responsibility for their space and belongings and teaches organizational skills  Use the top storage bins to hold small treasures and to keep art supplies neat The bins and art board lid are both removable to create a portable art space  In the box toy box base art board lid with clip 2 storage bins,a
250,5395,ff6da764e297a604a998d3d7b6ea6304,9 SOCCER BALL INFLATE,Toys & Games ,3,$8.02,Plastic  Imported  Rhode Island Novelty 9 Soccer Ball Inflates  One dozen per order  Inflates sold deflated  Favorite among soccer enthusiasts and beach bums alike  For ages 3,a
251,5407,467d2e5a3a63120804e28b928cff426c,PRINZ Man Money Curse Fund Piggy Bank,Toys & Games ,1,$16.00,Made from beautiful glazed ceramic with high gloss finish  Design is printed on both sides  You say itYou Pay it  Money slot on the top opening on the bottom  Arrives in a gift Box ready for gift giving,a
252,5227,11f0583299c812341361ca81ada5bf0b,Adora ToddlerTime Girl Doll Macaraccoon Weighted Vinyl Baby Doll Toy with Soft Body 20inch Ages 6,Toys & Games ,5,$86.49,Macaraccoon toddler baby doll is 20 from head to toe and made of baby powder scented high quality vinyl with a moveable head arms and legs Her weighted body comes complete with a diaper for realistic play to develop social skills while engaging in nurturing playtime  This toy baby doll comes wearing a removable orange empire waisted dress accented with a playful raccoon emblem red white and gray polka dot trim and adorable raccoon shoes to match  Her brunette banged hair and ringlet curls complement her big doe colored eyes while red pompom headband and leg warmers complete the toddler dolls whimsical woodland ensemble  Designed to last Adora Toddler dolls are handmade with love featuring hand painted faces made of the highest quality baby powder scented vinyl  Toy tested for children aged 6 BPA Free Non Toxic hypoallergenic Consumer Product Safety Commission CPSC Tested ToddlerTime dolls have been recognized by many Toy Industry Award Organizations with accolades such as Best Creative Fun Preferred Choice Best Classic Toy and more,a
253,5155,892cac2d4cd163b5a93bf10620269b6e,Ergobaby Metro Compact City Stroller Accessories BackpackStyle Carry Bag,Baby Products ,3,$30.00,0  48 Months,a
254,5047,cc200bd5afb47bd3936cbdc6b80cdd37,LIL TOTS Princess 14 Doll  Unicorn Set,Toys & Games ,3,$26.99,14 Princess doll with her very own unicorn  Includes hair accessories to dress up your unicorn or doll,a
255,5482,ef19c63947c9fda0b1d80b5f060d838b,Discovery Layers of The Earth Geology Sand Dig Kit by Horizon Group USA 3in1 Earth Exploration,Toys & Games ,3,$19.99,3 handson activities grow colorful sparkling crystals build and decorate an erupting volcano and excavate 11 precious gemstones  Scientific observation hone in on observation skills and patience as your child experiences The process of crystallization  Simple chemical reactions combine simple household materials and watch as they react to cause an eruption  Excavate  educate excavate and identify 11 precious gemstones then learn how real geologists use Streak plates to identify the true color of a stone  Age range 12 years  up,a
256,5258,1415fed85fb0f78111c2572fdf57dcd2,Gorilla Playsets 013036G Malibu Playhouse Wooden Playhouse for Kids Brown  Green,Toys & Games ,2,"$1,265.00",Highquality extendedheight malibustyle wood roof complete with attractive sunbursts pinnacle dormers with decorative windows a chimney and 2 solar wall lights  Malibu playhouse includes a large attractive front opening along with a side window perfect for selling lemonade in your backyard  Includes 2 large window openings 1 window with working shutters an arched entryway 2 solar wall lights and 1 lemonade sign for plenty of imaginative play options  Comes readytoassemble with stepbystep assembly manual and all required hardware All lumber is precut and presanded at the Factory  Ready to be assembled onto level ground allowing it to fit into most residential backyards,a
257,5123,193bbc5ac833527b38df3f6c88acdb56,GUND Baby My First Christmas Reindeer Lovey Plush Blanket 12 Brown,Toys & Games ,4,$13.79,REINDEER PLUSH BLANKET Combining a stuffed animal  security blanket this 12 lovey holiday plush features a reindeer holding a blanket with satin accents and embroidered with My First Christmas  SOFT  MACHINE WASHABLE This ultrahuggable plush is built to famous GUND quality standards to ensure safe play for all ages 0 Baby GUND plush are machine washable for easy cleaning  THE PERFECT GIFT Our plush dolls teddy bears  stuffed animals make perfect gifts for birthdays baby showers baptisms Christmas Easter Valentines Day  more Gift a lifetime of hugs with a GUND  QUALITY CUDDLES Known for quality soft huggable plush designs  gifts our awardwinning bears  toys appeal to all ages from infants  toddlers to adults perfect for play collecting  cuddling  PREMIER PLUSH The oldest maker of soft toys in America GUND was one of the first companies to produce a teddy bear For over 120 years GUND has been creating unique teddy bears  stuffed animals recognized worldwide for their quality and innovation,a
258,5129,0a92d664b10f16e38fb86cc591ad182d,Power Rangers 97376 Blaster Role Play,Toys & Games ,4,$62.93,Battle on the side of good with the Mighty Morphin Power Rangers Legacy Blade Blaster  This highly detailed replica includes die cast parts and sounds from the original TV series and morphs into 3 separate modes  Display or wear as gear to defeat evil like a Mighty Morphin Power Ranger  No Power Rangers collection is complete without this iconic piece of battle gear,a
259,5179,fbb3dd5666d96d6f33dc05e8ef36c966,Celebrity 24DCL 24 Latex Balloons Clear Pack of 10,Toys & Games ,1,$13.89,Helium grade jumbo round 24 latex balloons  10 fun festive balloons per package  Clear Balloons See Through  Great for indoor and outdoor use  Stays inflated for 2 days on one fillup of 999 helium  Inflate with air or helium for a major eyecatching look at parties and events,a
260,5423,d05ce0cf8892e4a9ad56b2b3b7b68a8b,Emoji Pals Kissy Kids Saucer Chair,Home & Kitchen ,5,$37.45,Fun emoji printed design  Perfect for nurserys playrooms and kids Bedrooms  Sturdy metal frame with locking mechanism  Dimensions 23 x 23x23,a
261,5027,e8ca697a9f4d83302063339fcd7ad253,Creativity for Kids My First Fun Felt Shapes  Travel Friendly Felt Board for Toddlers Imaginative Pretend Play for Kids 100Piece,Toys & Games ,4,$12.15,Felt board set for toddlers  see your childs imagination come to life as they layer simple felt shapes and wiggly eyes onto a childsized felt story board This felt board makes a great gift for kids ages 3  No mess and travel friendly toy perfect for airplane travel This felt board includes a neat and tidy storage bag to keep all your felt pieces organized Create your own story or design with this imaginative pretend play set  100 piece felt board set includes 100 pieces of felt a portable felt board and wiggly eyes that can be used to create felt pictures again and again Enjoy sensory and imaginative play with this complete felt board set  Learning toys for toddlers  your child will learn basic colors shapes patterns and size relationships  Important building blocks for prereading and beginning math skills Arranging the shapes will help foster fine motor skills and creative thinking  Creativity for little kids since 1976 Creativity for Kids has proudly created products designed to provide fun and creative experiences today to nurture childrens confidence for life,a
262,5339,5c987de5f8692ccd546aa3785645e6eb,Melissa  Doug Mine to Love Jordan 12 Baby Doll Includes Romper Cap Pacifier Great Gift for Girls and Boys  Best for Babies 18 Month Olds 24 Month Olds 1 and 2 Year Olds ,Toys & Games ,5,$16.82,BOUNCING BABY BOY The Melissa  Doug Mine to Love Jordan doll is a 12inch clothed boy baby doll with a light skin tone that can suck his thumb or pacifier  IDEAL SIZE FOR TODDLERS Our Melissa  Doug Mine to Love baby is 12inches long which makes him a great size for toddlers 18 months and up to hug cuddle and care for  REALISTIC FEATURES Our Jordan baby doll features wipeclean arms a removable smocked romper and matching cap He closes his brown eyes as he is rocked to sleep  GREAT FOR 18 MONTHS AND UP The Melissa  Doug Jordan doll is just right for toddlers 18 months and older Pair with the Mine to Love Changing  Bath Time Play Set to round out the handson screenfree play experience  THE GOLD STANDARD IN CHILDHOOD PLAY For more than 30 years Melissa  Doug has created beautifully designed imagination and creativitysparking products that NBC News called the gold standard in early childhood play  100 HAPPINESS GUARANTEE We design every toy to the highest quality standards and to nurture minds and hearts If your child is not inspired give us a call and well make it right Our phone number is on every product,a
263,5368,507f45a97083f6f8ae4fb0fd11963d32,Darice 916346 Wood Airplane Craft,"Arts, Crafts & Sewing ",1,$6.23,Wood airplane  Decorate your own wooden toys  Recommended for ages 8 and up  This product weighs 014pounds  Measures 418inch by 238inch,a
264,5138,bb8abd646e2df22707d58d6270d4d0a4,University Games Break Out Game Kids,Toys & Games ,5,$11.12,Make your escape  Who will break out of prison first  Join together the colored pieces of rope from top to bottom  Block your opponents escape route  For 2 players Recommended for ages 6 years and up,a
265,5526,b7be8e6025ce0e162a03f75e965d02d8,Anna Frozen Fever Deluxe Costume One Color 3T4T,"Clothing, Shoes & Jewelry ",3,$34.99,Printing on the back of the dress  Floor length  Beautiful attached Gem on bodice  Officially licensed product  Product Includes Dress with attached gem detachable petticoat and bolero,a
266,5575,1a87e17929a9a29a3161a87fbb86a18e,Crawl N Play,Toys & Games ,5,$37.99,Patented Twist  N Fold Technology allows for instant setup and easy storage  Tunnel port provides crawlthrough fun and structure expansion  Created with durable soft and colorful materials  Lightweight and portable for EZ play anywhere  This versatile play structure includes a large hideaway hut and a 25foot long detachable play tunnel,a
267,5593,37cded0a92727142293921e711c05e7a,Bicycle Rider Back Playing Cards,Toys & Games ,2,$3.49,Standard index Poker size  12 decks with the classic Bicycle rider back  Made in the USA,a
268,5004,0c36cae77b88555642434d7dcd34fa9b,Gigantosaurus Figures Giganto  Friends Toy Action Figures Includes Giganto Mazu Bill Tiny  Rocky  Articulated Characters Range from 2555 Tall,Toys & Games ,3,$7.89,Gigantic and friends includes all 5 main characters from the hit show Gigantosaurus  Mazy bill tiny and rocky are the best of friends and always help each other as they go on adventures to see what Gigantosaurus is up to  Create your own Gigantosaurus adventures with this complete figure set A perfect set for any Gigantosaurus fan  Articulated characters range from 2555 inches  For ages 3,a
269,5017,eba165b021370ee68be2236652cf06ae,Greenlight 164 Hobby Exclusive  196772 Ford F350 Ramp Truck with Truck Driver Figure Diecast Toy Car 29892,Toys & Games ,5,$12.99,Model  29892  Manufacturer  Greenlight  Color  Green  Scale  164  Official Licensed Product,a
270,5013,99ea31e1aca2db1727ed485118008d90,Top Notch Teacher Products Chart Tablet Polka Dot 1 12 Ruled Red 24 x 32,Office Products ,2,$20.18,Perfect for classroom Demonstrations of handwriting  It is a high quality 50 text weight paper  Heavierthicker than tablet paper Bleedresistant sheets,a
271,5315,2244b6a3a3c80cf3d148eb7b09d0e193,Schylling Shuffle Shot,Toys & Games ,4,$19.99,Comes with full detailed instructions  Game board is full sized  14 players,a
272,5543,ded138c8d2e126d79ccd19a8d0c7f192,Melissa  Doug Magnetivity Magnetic Tiles Building Play Set  School with School Bus Vehicle 106 Pieces STEM Toy Great Gift for Girls and Boys  Best for 4 5 6 7 8 Year Olds and Up,Toys & Games ,4,$44.32,Onepiece magnetivity magnetic building play set with a school theme lets kids design build and play with their own school again and again  Includes foodice cream truck vehicle 13 doublesided illustrated magnetic panels 87 magnetic accessories 2 magnetic wooden play figures with stands  Magnetic accessories stick to play figures and panels that magnetically attach in different combinations  Magnetivity encourages kids to experiment explore and imagine and inspires openended handson play  Makes a great gift for children ages 410,a
273,5478,33b592927ec0b9b5124d0cdf1cbb15df,Barbie Bride Costume Medium,"Clothing, Shoes & Jewelry ",4,$27.99,Barbie Bride Costume Medium  Barbie Bride costume comes complete with Dress glitter veil and bow clips  Barbie is officially licensed by Mattel,a
274,5204,b7fd8f1258a131e5e20066bc2560193e,My Own Pet Balloons Cat Domestic Animal,Toys & Games ,4,$10.49,Your pet comes with its own leash and pull tag attached for personalization  Your pet is precisely weighted to stand on its own feet  Your pet is refillable,a
275,5039,0b9df9bc7f554b556776ce0cf62debfa,Turtle Beach XO Three Gaming Headset for Xbox One,Toys & Games ,4,$ 53 98 $59.95 #listPriceLegalMessageText { margin-left: 4px !important; } #listPriceLegalMessage .a-popover-trigger:hover { text-decoration: none !important; } #listPriceLegalMessage .a-icon-popover { display: none !important; margin-left: 0px !important; margin-top: 6px !important; } Save $5.97 (10%),Rugged Comfortable Design  The XO Three has a thick and robust frame with a plush leather wrapped headband and breathable fabric wrapped ear cushions allowing you to play for hours in comfort  Large 50 millimeter Speakers  Hear every crisp high and thundering low with these large high quality 50 millimeter over ear speakers  Crystal Clear Chat  Turtle Beachs renowned high sensitivity mic picks up your voice loud and clear and can be removed when watching movies or listening to music  Convenient In line Controls  Convenient in line controls place Master Volume and Mic Mute right at your fingertips  Versatile Compatibility  Works great with Xbox One and PS4 controllers and PC Mac and mobile devices with 35 millimeter jacks Other Xbox One controllers require the Headset Audio Adaptor sold separately,a
276,5497,b00971a083cd293c234215584fbe6d34,Melissa  Doug Childrens Book  FloatAlongs Tiny Tugboats Bath Book  3 Floating Tugboat Toys Great Gift for Girls and Boys  Best for Babies and Toddlers 4 5 9 Month Olds 1 and 2 Year Olds,Toys & Games ,4,$9.99,FloatAlongs Tiny Tugboats bath book with 3 floating tugboat toys  6page book helps kids learn their primary colors  Tugboat toys store in mesh tube attached to book  Soft waterproof pages are easy for small hands to grasp  Great gift for babies ages 4 months to 2 years old for handson screenfree play  85 x 6 x 275,a
277,5153,1bc287229e08f42b571719d876fd9390,FisherPrice Slow Much Fun Stroller Sloth,Toys & Games ,2,$8.29,Portable sloth toy for babies from birth  8 Sensory Discoveries engage your babys senses of sight and touch  Pull the sloths hand down to see it slowly climb back up to the branch  2 hanging toys sunshine mirror and crinkly leaf  Link attaches to stroller for takealong play  Size  Ages 0  36 Months,a
278,5400,c1f6fdcb7200c11653033eca32baacc4,Triple Eight Sweatsaver Liner Skateboarding Helmet Zest Rubber Small,Sports & Outdoors ,1,$33.81,Classic skate helmet for kids youth and adults with ABS outer shell and stinkfree moisturewicking Sweat saver liner  Ideal for skateboarding roller skating and roller derby  Included Sweat saver liner attaches with hookandloop tape and is easilyremovable for cleaning Adjustable chin strap  Available in six sizes XS fits 20 120 5 in 5152 cm S fits 20 621 3 in 5254 cm M fits 21 422 in 5456 cm L fits 22 122 9 in 5658 cm XL fits 2324 in 5861 cm XXL fits 2425 in 6062 cm  To determine proper size measure with a soft tape measure or string manufacturers 180day limited,a
279,5351,89d180e819d5a779ddec1f8737488821,Rollerblade Twister Edge Mens Adult Fitness Inline Skate Black and Red High Performance Inline Skates,Sports & Outdoors ,3,$249.00 - $273.90,HIGHLYVERSATILE MOLDED SHELL  Created for urban fitness commute and recreation  ENHANCED WRAPPING  Molded support with a Vcut cuff for added flexibility with slalom skating  FIRST FIT HIGHPERFORMANCE LINER  Shaped ankle heel lock padding First Fit tongue and instep wrap heel shock absorber cuff buckle microadjustable buckles and lace closure system  MAXIMUM POWER TRANSFER  Anti Torsion Box in the sole and aluminum plates in the shell ensure frameshell connection is rigid frame can be upgraded to 3WD 110  ROLLERBLADE SUPREME WHEELS  80mm85A wheels with ILQ5 bearings reduce wear and maximize speed,a
280,5339,c4516bf26345dc3de65d173bfdc3416f,Click N Play Military Police Elite SWAT Patrol Team 32 Piece Play Set with Accessories,Toys & Games ,2,$18.79,Military action packed pretend play set made of super strong superior quality BPA free plastic material with Authentic highly detailed design with uniforms  accessories  Set includes 3 SWAT team soldiers 1 obstacle wall 4 pcs 4 rifles 1 patrol boat with anchor 1 motor 2 paddles 1 motorcycle 1 security gate 2 road barriers 2 cones 1 jerry can 1 oil barrel 1 baton 1 bullet proof vest 1 grappling hook 1 laptop 1 riot shield 1 battering ram 1 cutter tool 1 hammer 1 halligan 1 crowbar  Fully poseable 118 action figures that can stand alone with 22 articulated joint points  A great set to enhance your childs imaginative skills and keep them busy for hours also a great addition to other Click N Play Military Action Figure Play Sets  COLLECT THEM ALL Also available from Click N Play military army base command center military navy dinghy boats combat and rescue helicopters army tank military action figure sets military vehicles and more,a
