Unnamed: 0,User_Id,product_Id,title,category,rating,price,description,image
0,5332,4c69b61db1fc16e7013b43fc926e502d,DB Longboards CoreFlex Crossbow 41 Bamboo Fiberglass Longboard Complete,Sports & Outdoors ,5,$237.68,RESPONSIVE FLEX The Crossbow features a bamboo core encased in triaxial fiberglass and HD plastic for a responsive flex pattern thats second to none Pumping  carving have never been so satisfying Flex 2 is recommended for people 120 to 170 pounds  COREFLEX TECH CoreFlex construction is water resistant impact resistant scratch resistant and has a flex like you wont believe These boards combine fiberglass epoxy HD plastic and bamboo to create a perfect blend of performance and strength  INSPIRED BY THE NORTHWEST Our founding ideal is chasing adventure  riding the best boards possible inspired by the hills waves beaches  mountains all around our headquarters in the Northwest  BEST IN THE WORLD DB was founded out of sheer love of longboarding with a mission to create the best custom longboards in the world to do it sustainably  to treat customers  employees like family  BEYOND COMPARE Try our skateboards  accessories if youve tried similar products by Sector 9 Landyachtz Arbor Loaded Globe Orangatang Hawgs PowellPeralta Blood Orange Caliber or Gullwing,a
1,5272,66d49bbed043f5be260fa9f7fbff5957,Electronic Snap Circuits Mini Kits Classpack FM Radio Motion Detector Music Box Set of 5,Toys & Games ,4,$99.95,Snap circuits mini kits classpack provides basic electronic circuitry activities for students in grades 26  Includes 5 separate mini building kits an FM radio a motion detector music box space battle sound effects and a flying saucer  Each kit includes separate components and instructions to build  Each component represents one function in a circuit components snap together to create working models of everyday electronic devices  Activity guide provides additional projects to teach students how circuitry works,a
2,5336,2c55cae269aebf53838484b0d7dd931a,3Doodler Create Flexy 3D Printing Filament Refill Bundle X5 Pack Over 1000 of Extruded Plastics  Innovate,Toys & Games ,4,$34.99,Smooth 3D drawing experienced the best 3D drawing experience by only using 3Doodler Create Plastics with 3Doodler Create and create 3D Printing pen  Safe to usethe 3Doodler Create Plastics conforms to the health requirements of ASTMD4236  require no additional labelling in accordance with the US Consumer Product safety Commissions Regulations as mandated by Labeling of Hazardous Art Materials Act LHAMA  3Doodler very own Type of plasticthe FLEXY plastic takes creativity to new levels You can make flexible fun 3D creations  Environmentally friendly3doodler create Plastic is made of corn and are 100 compostable  125 strands of drawing funthis bundle includes 5 refill filament packs thats a total of 1043 ft Of 3D drawing and doodling fun  The 3Doodler appget an interactive experience The app is packed with dedicated easy to follow stencil section and step by step interactive instructions receive badges for completed projects and photograph  share YOUR creations directly on social media The app is fully built on iOS  Android  All your favorite colorsthis pack includes green blue pink orange  yellow,a
3,5318,18018b6bc416dab347b1b7db79994afa,Guillow Airplane Design Studio with Travel Case Building Kit,Toys & Games ,1,$28.91,Make 8 different Planes at one time  Experiment with different designs and learn about flight  All contained in Part trays inside an attractive box with carry handle  Guillows  your one source for flying toys since 1926  Made in the USA,a
4,5377,e04b990e95bf73bbe6a3fa09785d7cd0,Woodstock Collage 500 pc Puzzle,Toys & Games ,5,$17.49,Puzzle has 500 pieces  Completed puzzle measure 14 x 19  100 officially licensed merchandise  Great for fans  puzzlers alike,a
5,5123,40d3cd16b41970ae6872e914aecf2c8e,Rubies Childs Pokemon Deluxe Pikachu Costume XSmall,"Clothing, Shoes & Jewelry ",5,$29.12,Polyester  Deluxe Pokemon childs Pikachu costume features a fleece jumpsuit with attached tail and headpiece with attached ears and printed face  Officially licensed Pokemon costume look for trademark on packaging and label to help assure youve received authentic safetytested item  Important Costumes are sized differently than apparel use the Rubies Child Size Chart do not choose based on childs age or clothing size  Group costume fun coordinate with additional Pokemon costumes and accessories available from Rubies  Familyowned familyfocused and based in the USA Since 1951 Rubies has classic and licensed costumes and accessories in sizes and styles for your entire family,a
6,5397,cc2083338a16c3fe2f7895289d2e98fe,ARTSCAPE Etched Glass 24 x 36 Window Film 24by36Inch,Home & Kitchen ,3,$12.99,The visual effect of textured glass and stained glass  Creates privacy  Provides UV protection  No adhesives  Applies easily  Patterns repeat to cover any size window  Made in USA,a
7,5011,7b0746d8afc8462ba17f8a763d9d5f1e,Moonlite 3Story Bundle for Boys Includes 3 Story Reels for Use with Storybook Projector,Toys & Games ,2,$18.16,3 story reels make reading even more magical with the Moonlite story reels bundle With 3 story reels included in this set read adventurefilled tales about Pirates Dragon and a TRex to your little boy any time of day and enjoy them again and again  Easytouse portable storybook projector The tales included in this 3pack come alive with Moonlite Clip the projector sold separately onto your smartphone not included slide in one of the sets story reels and project vibrant images onto any surface Moonlite is lightweight and small enough to carry with you wherever you go  Develop a love of learning adored by children and adults awardwinning Moonlite and the story reels create an immersive reading experience that instills a love of learning at a young age As kids follow along to their favorite stories they develop their imagination creativity and language skills  The Moonlite 3story bundle makes a great gift for boys aged 3 and up and includes 3 story reels Read tales like how to be a pirate there was an old Dragon who swallowed a Knight and Im a TRex Works with the Moonlite storybook projector sold separately  Includes 3 story reels 1 activation card 1 quick start guide,a
8,5318,c5f4c94653a3befd8dd16adf2914c04e,DC Cover Girls Black Canary by Jolle Jones Statue,Toys & Games ,5,$84.61,Designed by Joelle Jones  Sculpted by Jack Mathews  Rebirthera character design  Limited to 5 000 pieces  Individually numbered,a
9,5366,615ba903c134f439eaf8cdd1678ceb5c,Baby Doll Bedding Chevron Window Valance and Curtain Set Orange,Baby Products ,5,$33.92,Fits most standard sized windows  Modern chevron design  Fabric content chevron and solid poly fabric,a
10,5204,82c86a4d24dce5e14303033d7b658b78,LEGO Minecraft Creeper BigFig and Ocelot Characters 21156 Buildable Toy Minecraft Figure Gift Set for Play and Decoration New 2020 184 Pieces,Toys & Games ,2,$14.99,Put Minecraft adventures in kids hands with authentic realworld LEGO models of two iconic characters from the popular video game a LEGO BigFig Creeper and an Ocelot that are fun to build play with display and collect  The extralarge easytobuild BigFig Creeper and the Ocelot add a whole new physical dimension to the Minecraft game and movable limbs maximize possibilities for independent play and action poses  This awesome LEGO Minecraft BigFig Creeper and Ocelot are fun to build bring the video games actionpacked creativity to life and are great additions to any LEGO Minecraft fans collection  This easytobuild LEGO set makes a great holiday birthday or anyday gift for all Minecraft players ages 7 and up and anyone wanting to expand their LEGO Minecraft collection  At over 4 10cm tall the BigFig Creeper offers Minecraft fun on a large scale whether its sharing an adventure with the Ocelot over 1 or 5cm tall or spreading panic among other LEGO Minecraft BigFigs,a
11,5165,1ecccb43e0f5c0162218371916ffa553,CD Visionary DC Comic Originals Flash Logo Sticker,Toys & Games ,5,$4.99,Sticker is great for Walls Doors Desks Guitars Cars Windows and Notebooks  Comes ready to install just peel the back and apply on clean surface  Great to be used on any scrapbooking projects  The absolute best sticker you will ever own is now available,a
12,5003,d1ac6d805fcdf75f9e00af611dd03ce4,The Learning Journey ABC Melody Maker Primary,Toys & Games ,3,$34.39,ABC Melody Maker is an exciting electronic learning companion featuring five fun games and a ten note musical keyboard sure to entertain and educate youngsters  This colorful interactive unit features an activity selector that puts kids in charge of choosing their fun  Children wont even realize theyre learning Song book included  Requires three AA batteries included  For ages 3 and up  Cheerful melodies  5 educational games  Develops language skills  Reinforces listening and comprehension abilities,a
13,5274,d82015ffbf4cd54b0edfb890002971f3,The Complete Common Core State Standards Kit Grade 5,Toys & Games ,3,$12.88,Perfect allinclusive resource for teachers  Provides focus for instruction in the perfect timesaving format  Preprinted easily organized system that provides an entire list of Common Core State Standards in both math and language arts  Includes divider cards gradespecific 2sided cards with I Can statements on one side and the corresponding standard on the other  124 standards cards 11 dividers,a
14,5139,39f1b8a2129315da0288cd058b6b6086,Flash Furniture 25W x 45L Trapezoid Red HP Laminate Activity Table  Height Adjustable Short Legs,Home & Kitchen ,3,$117.26,Collaborative Trapezoid Activity Table  Table can be used alone or grouped together for cooperative learning  Recommended Grade Level Preschool  Recommended Seating Capacity 3 Children  Scratch and Stain Resistant Surface,a
15,5030,4af0833f20a8421788fc04577b0ef1c5,Schylling Veterinarian Kit,Toys & Games ,1,$9.39,For the animal lover in the family a complete veterinarian kit perfect for the aspiring vet  Contains everything you need 8 specialist veterinarian tools Clipboard and 2 special xray cards that you can see through when held up to the light  A great STEM steam toy learn about animals and their health needs Features dogs cats rabbits horses and a potbellied pig  Comes in a portable doctors bag that holds everything in special trays secures with a clasp and has a fold down handle  An excellent gift for boys and girls ages 3,a
16,5177,fd71391871b94ead84733bc272dd5886,Yellies Frizz VoiceActivated Spider Pet Ages 5  Up,Toys & Games ,5,$17.85,Soundactivated movementyell talk sing clap or play music  The louder you yell the faster they go  Each cuddly yellies Spider has a unique personality Find your favorite  Watch yellies Pets eyes light up and legs move as they respond to your voice  Includes 1 bellies Ages 5 and up,a
17,5537,a84f14dd0114d78f178b16f093cab0e0,Disney HK318329 Sofia The First Sleepover Set,Toys & Games ,4,$27.50,100 Polyester  Features colorful and unique Sofia the First designs  Perfect for traveling and sleepovers  Set includes eye mask slumber sack and carry purse  100 Polyester  Slumber Sack Dimensions 27 x 57,a
18,5471,f5b9392a03cfae8817307a36411c8b17,Team Associated 9665 Hinge Pin Brace with Hinge Pins B4T4,Toys & Games ,1,$10.99,Anodized blue  Perfect for the racing enthusiast  Aluminum Construction,a
19,5185,89a993dbc079cc3fbe9088c8170b6f99,PLUS PLUS  Construction Building Toy Open Play Set  3600 Pieces with Storage Tub  Basic Color Mix,Toys & Games ,4,$159.99,SIMPLE DESIGN  FUELS CREATIVITY One shape endless possibilities Every brick easily connects to the next Create colorful flat mosaics or work in 3D to make more intricate builds Mix and match any PlusPlus set to bring more ideas to life  EDUCATIONAL FUN PlusPlus empowers children with free explorative play as they encourage fine motor skills logic creativity and imagination all without the use of screens A great STEM toy  PERFECT FOR ONTHEGO Design and build your creations any way you want wherever you want Great for every adventure  car rides restaurants a friends house or in your own living room Stay entertained for hours  Playset includes 3600 pieces inside a reuseable storage tub and an Idea Guide Booklet for building,a
20,5123,84fb43b933850dc05e57a162c5ba1702,Big Party Pack Orange Peel Plastic Plates  1025  Pack of 50  Party Supply,Toys & Games ,1,$12.63,Big party pack lunchdinner plates 10 5 50pkg sturdier than most standard plastic plates bright and vibrant color 10 5 inch plates made in the USA,a
21,5031,af983053a35fa2a843092369ff3b400b,Peppa Pig Shape Sorter Clock Puzzle 12Piece,Toys & Games ,3,$11.88,The removable brightly colored wooden shapes with numbers printed beneath the shapes allow for greater interaction and ease of matching  With this shape sorter clock learning to tell time is made fun and simple  12 diecut wooden shapes clock face labeled with hours and minutes wooden clock stand and bright fun colors with smooth edges,a
22,5371,326ebcfaa8d5204b634b5648e88e2fe4,NKOK Sonic and Sega All Stars Racing Remote Controlled Car  Sonic The Hedgehog,Toys & Games ,5,$26.99,Requires 6AA batteries not included  This product was awarded the Fun Stuff award by Parents Choice Foundation  For Ages 6 and Up  Official sonic product  Full function radio control  Requires 6 AA batteries not included  Limited availability  New and sealed inside retail packaging,a
23,5214,a11d9462309527143094a0f68bce0a58,Industro Stainless Steel Hose Clamps,Home & Kitchen ,1,$34.27,Rectangular perforations help to hold strong and connect easily Color Silver  Tub makes for easy storage Product Dimension 2D x 0 6H x 2W  Size 134 Size range 34 to 134 Finish Stainless Steel  AISI 300 series stainless steel material  Corrosion resistant  1 year,a
24,5283,fdd8daf07ddd4a23832f3da7d209252f,Oopsy Daisy Birchwood Owl Growth Chart Pink 12 x 42,Baby Products ,4,$18.70,Art by Jen Christopher  Colorcoordinated decorative covers are supplied that fit over the screw or nail to create a finished look  Grommets are placed in the corners to make hanging easy  Ideal gift for baby showers and first birthdays  Easy to store  just roll up each height chart as a treasured keepsake,a
25,5391,c15e7efbe14b9bbcb8b7fe31f9818021,Springbok Puzzles  Christmas Wishes  400 Piece Jigsaw Puzzle  Large 2675 Inches by 205 Inches Puzzle  Made in USA  Unique Cut Interlocking Pieces  Big Pieces for Kids  Small Pieces for Adults,Toys & Games ,2,$14.95,400 PIECE JIGSAW PUZZLE  Featuring a finished size of 2675 inches by 205 inches with a precision cut that ensures a tight interlocking heirloomquality puzzle  MADE IN USA  Manufactured in Kansas City Missouri Springbok Puzzles have been American made since 1963  ECOFRIENDLY  Springbok Puzzles are manufactured with sustainably sourced organic nontoxic soybased inks  utilizes 100 recycled puzzle board materials  UNIQUE CUT PIECES  Each puzzle piece is unique and never repeated Springbok Puzzle pieces are made from thick cut 75 point board 18 thicker than the industry average  EASY NO HASSLE PUZZLE WARRANTY  All Springbok Puzzle products are covered with our satisfaction guarantee on materials and craftsmanship,a
26,5541,5bb4a9aa52085ada20006d166b1e2f87,Franklin Sports Eye Black Stickers for Kids  Customizable Lettering Baseball and Football Eye Black Stickers  White Pencil Included,Sports & Outdoors ,2,$6.91,EASY USE Just peel and stick these eyeblack stickers under the eyes to use This non toxic material is safe to use and will stay on as long as you need No mistakes no mess  FULLY CUSTOMIZABLE Write anything you want on these eyeblack stickers to personalize them exactly to your liking  WHITE PENCIL INCLUDED The special white pencil to write on your stickers is included in the set so youll have everything you need  REDUCE GLARE The eye black stickers will help reduce glare from the sun and bright lights so you can keep your eye on the ball  PERFECT FOR ALL AGES These stickers are a great way for players young and old to reduce glare and add some style to their look,a
27,5158,2339c5be505bf647ebff669697c6bc25,Costume Sunglasses Clown from IT SunStaches Party Favors UV400,Toys & Games ,3,$5.99,All SunStaches Sunglasses provide 100 UV400 protection and impact resistant lenses because we care  Instant party starter and very comfortable to wear  Great for kids and adults one size fits most  As seen on the popular show Shark Tank  Officially licensed product,a
28,5345,93c659c89f9a1a81374c61c3fdf881bb,Jay Franco Disney Frozen 2 Forest Spirit TwinFull Comforter  Sham Set Mutli,Home & Kitchen ,2,$36.37,100 Polyester  PERFECT FIT  FUN DESIGN  Reversible twinfull sized comforter measures 72 inch x 86 inches and sham measures 24 inch x 20 inches Add a touch of decorative enchantment to your room with our fashionable and super soft Disney Frozen 2 comforter Colorful and magical design features your childs favorite Disney sisters Elsa and Anna  HIGH QUALITY  EASY CARE  Keep your little one as cozy as can be Frozen 2 comforter is super soft and great for all seasons 100 brushed microfiber polyester allows for a comfortable nights sleep Fade resistant and machine washable To clean machine wash cold To dry airtumble dry on low  GREAT GIFT  This Disney Frozen 2 comforter will make any child smile and will transform any bedroom guest room kids room RV or vacation home Great gift for school or home It rolls up for easy storage and travel This only the comforter sheet set is sold separately  SHOP THE FROZEN 2 COLLECTION  Complete your bedroom with our other Disney Frozen 2 products  Coordinating bedding and accessories available sold separately  OUR FAMILY COMPANY  Our company is still small and family run We take great pride in our products and our unsurpassed customer service We know that our wonderful customers are the reason we are in business We offer excellent quality nontoxic products With our coordinating Frozen 2 accessories you can mix and match our highquality and unique boys comforter sets girls comforter sets kids sheet sets or kids pillows,a
29,5104,25a1fcc6db40f86566c5f2d902407b15,TAMASHII NATIONS Bandai SH Figuarts Captain America  Tamashii Effect Explosion Avengers Infinity War Action Figure,Toys & Games ,4,$60.87,Battle damage detailing to his costume have been carefully replicated and a digitally colored head is included  Product size approx 61  Package size approx 112x7 5x5 1 in,a
30,5231,171c7524e8cf032d08d1315f3a538345,Forum Novelties Union Officer Childs Costume Medium,"Clothing, Shoes & Jewelry ",5,$21.07,Union Officer child costume contains shirt coast with gold tone buttons and pants with decorative trim  READ BEFORE BUYING Costumes are not the same sizing as clothing read size chart Q  A and reviews to know the best size for your child  Medium fits children 46 to 53 Inch tall up to 62 pounds  Hat and gun sold separately  Forum Novelties makes costumes and accessories for dressup stage performances costume parties Halloween and more,a
31,5553,4449b3fa30a6becd3ede26511c8b2180,Disney Mickey Golf Ball Spinner Pewter Key Ring Key Accessory,Toys & Games ,5,$8.44,Makes a great gift  Interesting spinning component  A Disney and golf fan dream,a
32,5152,4832387affc268b3c9d6cca70dbdbcb4,Anagram International 3085101 Go Team Megaphone Shop Balloon Pack 29,Toys & Games ,2,$6.45,Top quality foil will float for one week with helium  Selfsealing valve seals itself during inflation  Highly durable  This product is easy to use and highly durable  Manufactured in USA,a
33,5576,487a3cc651bddbccb4738ef1e5aa40d0,Happy Birthday Jointed Letter Banner Under Construction,Toys & Games ,5,$3.12,Diecut block letters strung together relay your birthday message to all who read it  Includes one 8 long x 7 tall banner  Trim any doorway wall or banquet table  Create a fantastic themed party from beginning to end  Shop Creative Convertings extensive line of coordinating Under Construction themed party supplies dinnerware and decorations,a
34,5531,c3296d8ad42c3998c205f0dbca3998f3,Poopsie Unicorn Crush with Glitter and Slime Surprise 2Pack,Toys & Games ,1,$6.94 $ 6 . 94,Make magical sparkle slime with Poopsie Unicorn crush  Dip in water then crush in separate dry bowl for a glitter explosion Dip in water then crush in separate dry bowl for a glitter explosion  Mix included premade slime into the glitter for magical sparkly slime  Includes a clear unicorn horn to store and display sparkle slime  35 to collect in so many colors of glitter and slime,a
35,5325,a1793c26a96a83a1544300a431e62902,Klutz Decorate This Journal Toy,Toys & Games ,3,$16.01,A guided journal that you personalize inside and out  Learn frostinglike techniques  Highquality puffy paste and fancy charms plus Klutz clear instructions how to use them  Great for Ages 8  Includes a 60 pages of instructions and journal pages,a
36,5360,486702a222224c41f9e243713d03f27a,Random Esoteric Creature Generator for Classic Fantasy Rpgs  Their Modern Simulacra,Toys & Games ,2,$19.94,Looking to instill a little fear in your Game Then look no further  Nothing brings the thrill  and terror  of discovery to a Game like new monsters Faced with the unknown mightythewed heroes tremble in their hauberks Wizen Wizards fumble with their spell books and even the most audacious of rogues hesitate before plunging into battle  Nevermore worry that your players have memorized every monsters stat power and weakness Nevermore Resort to tired fantasy clichs and worn out monsters fought a thousand times before The random esoteric creature generator ensures that each Monster your PCs cross is unique unexpected and best of all  Unknown  With an unlimited number of horrific combinations This is the last Monster book you will ever need  Bring terror back to the table with the random esoteric creature generator,a
37,5173,6eedbf9388a4d905870f8fcd20790823,Bachmann Trains Great Northern Gondola,Toys & Games ,3,$22.38,Blackened machinedmetal wheels with RP25 contours  Magnetically operated body mounted EZ Mate couplers  Nonmagnetic blackened brass axles with needlepoint bearings  Celcon trucks  Added weight for optimum tracking,a
38,5577,dbf306088532d98d12f7da924cb4e87b,Disneys Alice in Wonderland The Hatters Mad Woven Tapestry Throw Blanket 48 x 60 Multi Color,Home & Kitchen ,3,$35.00,Features the mad hatter from the liveaction film on a fun green background  Detailed woven throw blanket Decorative fringes around all edges  Measures 48W x 60L  Machine wash cold separately using delicate cycle and mild detergent Do not bleach Machine dry separately on gentle cycle Remove promptly Do not iron,a
39,5475,437d953bb394e40c86873504d40e1b44,Pacific Play Tent Agility Dog Training Chute,Pet Supplies ,4,$37.98,Tunnel size 3 ft x 24 inch with 8 ft chute  Tunnel collapses flat for easy storage and portability  190T 70 Denier Polyester Taffeta fabric with durable construction for long lasting play and fun  Interior padding around hardened heavy duty spring steel wire structure for safety and playtime comfort  Easily wipes clean with a damp cloth and mild soap  indoor or outdoor use  One end of the dog training tunnel has a Velcro lip to attach the training chute,a
40,5286,e84e6e3a05a6fc610ff155b851fa1713,Barbie Babysitters Inc Popcorn Set,Toys & Games ,4,$9.93,Play out babysitting stories with these Barbie that come with themed babysitting supplies  Choose from dolls with different looks and different accessories  Each doll wears a casual outfit with a matching pair of shoes and comes with five additional pieces  Accessories include items like a bottle cell phone and list plus a unique food piece and a popular childs toy  Collect them all,a
41,5239,54f37f5ba4be7549cdf4a945bf1bdaad,Losi Ride Height Gauge LOSA99173,Toys & Games ,3,$11.99,Ride Height Gauge will work with all 110 and 18scale vehicles  Rugged construction ensures the gauge will not fail or break easily  Clear markings make the gauge easy to read and use,a
42,5315,4f41e104e3332ef045a90d8a294ffbd5,Melissa  Doug Disney Cinderella Rags to Riches Wooden Magnetic Game With 10 Magnetic Pieces and Wand,Toys & Games ,1,$11.12,Melissa  Doug Cinderella Rags to Riches Wooden Magnetic Game,a
43,5193,a6c9ec0ff537edf9736f99b3ca993506,VTech Twist and Hug Koala Rattle,Toys & Games ,3,$7.99,Press the twinkling heart button to trigger phrases about feelings fun facts about the koala silly sounds and entertaining music and songs  Your little one will be delighted when shaking the adorable koala hearing playful sounds and short tunes  Twisting the koalas colorful textured ears develop motor skills and promote tactile stimulation  Easygrasp textured handle is perfectly sized for little ones to hold and shake plus its great for onthego play  Intended for ages 324 months Requires 1 AAA battery Battery included for demo purposes only new battery recommended for regular use,a
44,5530,82be0dec20a875155a066440ef111310,Marvel Avengers Assemble Captain America Costume TShirt with Mask Small,"Clothing, Shoes & Jewelry ",3,$10.36,100 Cotton  Marvel Avengers Assemble Captain America Costume TShirt with Mask Small  Printed shirt and molded halfmask  Officially licensed Marvel Universe merchandise inspired by the Disney XD cartoon Avengers Assemble,a
45,5368,4cd74df98f6a204869dbc31ba3749d3c,Vallejo Game Color Sunblast Yellow Paint 17ml,Toys & Games ,4,$3.06,This range contains all the frequently used colors in fantasy figures  16 highly pigmented acrylic colors formulated to provide especially mat and opaque coatings  When applied over a basecoat they enter into the folds and grooves of the figure and instantly bring forth the features,a
