Unnamed: 0,User_Id,product_Id,title,category,rating,price,description,image
500,5226,d7123f13acb4e6f521c4299ac8aa30f8,FATHEAD AH64 Apache Longbow Helicopter Real Decals,Baby Products ,3,$102.99,Largest decal size as shown is 94W x 33H  Thick highgrade vinyl resists tears rips and fading MADE IN THE USA Officially Licensed  Fathead Wall Graphic  Decor  MAKES A GREAT GIFT  Ideal for decorating a home or office apartment or dorm Can be moved and reused without damage Forget painting or hanging anything that requires nails glue or tape Just peel stick and impress Its that easy  Official United States Army Fathead  ONLY buy your Fathead on Amazon if its listed as In Stock and SHIPS FROM and SOLD BY AMAZONCOM to know you are getting an official Fathead decal,a
501,5225,bb73dcf116b625ee294970951b6a5f55,Blue Youre Invited Sweet Safari Invitation Postcards,Health & Household ,3,$7.66,20 postcards per pack measures 425 x 625 each  Youre Invited blue giraffe illustration in leopard and zebra print invitation postcards  Perfect for baby showers parties and announcements  Match with other baby shower party accessories,a
502,5227,539ed3efe7862680a8feb8bf2718d2f5,Sesame Street Abby Cadabby On the Go Case,Toys & Games ,3,$15.24,Holds 3 figures Includes 1 Abby Cadabby figure and 1 Elmo figure Other figures sold separately  Sized for preschool hands  Fun character cases to take on the go  Includes carry case 1 Abby Cadabby figure and 1 Elmo figure,a
503,5071,e87dd1fcbb133c80b2c89687e8edf739,Ceaco Perfect Piece Count Puzzle  Roger Nannini  Acme Flying School,Toys & Games ,2,$17.99,Welcome to ceacos brand new custom puzzle program  Whether you prefer 300 550 750 1000 or even 1500 piece puzzles  you can now get the images you like In your favorite piece count  Made with premium quality chipboard  Comes with a poster inside a specially designed giftfriendly box  Stop compromising and start customizing  Completed Puzzle Dimensions 266 x 191,a
504,5496,e62e033094221892fb6caefbbf81397f,Disney Tangled Rapunzel Secret Journal Toy,Toys & Games ,1,$14.20,Magic rocks unlock journal automatically  Blank sheets with color gradient  Stencil included allows Rapunzel to express her inner world and creativity  Recommended for ages 3,a
505,5023,9bbf377ffb579f99c442d7985af045f2,Pressman Harry Potter TriWizard Tournament Game,Toys & Games ,5,$5.99,Perfect for the Harry Potter Super fan  Classic POP N Race gameplay with a twist  Race through the Triwizard maze to get to the finish line but beware of magical spell cards which could send you back to start  For 24 players ages 5 and up,a
506,5339,2ca852f75453280fd74e1ce8841fbd80,Osmo  Detective Agency A Search  Find Mystery Game  Ages 512  Explore The World  for iPad and Fire Tablet  2 HandsOn Learning Games  Creative Drawing  Problem SolvingEarly Physics,Toys & Games ,3,$39.99,OSMO IS MAGIC Funfilled  award winning learning games that interact with actual hand held pieces  an iPad andor Fire Tablet bringing a childs game pieces  actions to life No WiFi necessary for game play  AGE  CAPABILITY Ages 512 Game is designed for beginner to expert levels Osmo enables the continuation of learning  TEACHING Use a game piece magnifying glass search for landmarks around the world while also learning trivia facts about geography culture and history Detective Agency  WHATS IN THE BOX 4 doublesided maps Map holder  Magnifying glass  1 Game App Detective Agency  OSMO IS MAGIC Funfilled  award winning learning games that interact with actual hand held pieces  an iPad bringing a childs game pieces  actions to life No WiFi necessary for game play  CAPABILITY Games are designed for beginner to expert levels Osmo enables the continuation of learning  TEACHING Use the Osmo Base for iPad to play any of the Osmo games An Osmo Base is required for game use Ships with two games problem solvingearly physics Newton and creative drawing skills Masterpiece  WHATS IN THE BOX Osmo Base for iPad  2 Game Apps Masterpiece  Newton,a
507,5479,b0afcea9fcaad5acfc8158231e319581,The Kids Room by Stupell Yellow Dump Truck with Blue Border Stretched Canvas Wall Art 16 x 20 MultiColor,Baby Products ,3,$25.79,Dimensions 10 x 05 x 15 Inches  Proudly Made in USA  Lithograph Print Mounted on Sturdy 05 Inch MDF wood  Hand Finished  Ready to Hang  Colorful art for your childs space thats just as fun as they are  Design By Bealook Kids,a
508,5250,2259a76efa7fe554a68e881a12958aec,Little Tikes Big Digger Sandbox,Toys & Games ,4,$34.99,Sand area features molded in ramps and roadways  Use the real working excavator to dig in the sand and load up the dump truck  Truck ramp doubles as lid to keep sand dry  Accessories included 2 characters sand cup sand sifter shovel rake dump truck,a
509,5406,9386b26d1b9f851e63cfd3b41ffb13f9,DisneyPixar Cars Lightning McQueen with Sign Vehicle,Toys & Games ,5,$8.18,Enchanting diecast assortment gives kids the chance to reconnect with their favorite DisneyPixar Cars characters  Vehicles are 155 scale diecast  From grills to wheels these little vehicles are authentically styled for realistic fun  Collect them all and have a blast recreating fun racing scenes from all of the films  A must have for any DisneyPixar Cars collection,a
510,5122,1eefd4a9f26e2d87c4c6313fae4a9806,Wildkin 5 Pc Bedding Twin Heroes,Home & Kitchen ,2,$79.99,SWEET DREAMS  Drifting off to slumber land is a breeze when your child is snuggled up in Wildkins ultracozy Twin Bedding Set The 5 Piece Twin Bedding Set comes complete with a printed comforter flat sheet fitted bottom sheet coordinating pillowcase and embroidered sham The comforter flat sheet and fitted sheet all fit a standard twin mattress The matching pillowcase and embroidered sham both fit a standard pillow Trust us between the super soft microfiber material and bold Olive Kids pattern little ones will be cuddled up and dreaming soundly in no time  100 SUPER SOFT Microfiber  Wildkins 5 Piece Twin Comforter features a 100 microfiber exterior thats perfect for cozy cuddles Its lightweight material makes the Twin Comforter breathable enough for hot summer nights while keeping your little one nice and warm once those colder months roll around The Twin Bedding Set is sure to keep your child super comfortable whatever the climate may be  ALL ABOUT THE DETAILS  At Wildkin we know that details matter to you and your child and we made sure that our Twin Bedding Set was designed with that in mind Featuring vibrant playful Olive Kids designs on each of the five included pieces your little one will love this fun addition to their room While the exterior of the Twin Comforter is bursting with character the microfiber interior is solid creating a sweet contrast The coordinating flat sheet fitted sheet pillowcase and embroidered sham tie the theme together for a bold whimsical look that you and your child will love  VIBRANT COLORS THAT LAST  We know that accidents happen which is why we made our 5 Piece Twin Bedding Set easytoclean so your child can get back to snoozing Just wash the pieces separately on a cold gentle cycle and tumble dry on low heat Our vibrant colors were made to last so you dont have to worry that theyll fade after washing  COORDINATES WITH OTHER WILDKIN ROOM DCOR  Make a theme out of it Each Twin Bedding Set was designed to coordinate with other Wildkin room dcor From plush pillows to toy chests to storage cubes your little one will love seeing their favorite designs pop up throughout their room,a
511,5496,24f9f7e193c6571e7b597bdf79ad7504,My Little Pony Friendship is Magic Fluttershy Soft Plush,Toys & Games ,1,$9.99,Soft and huggable body  Beautiful sculpted hair  Fluttershy from My Little Pony Friendship is Magic TV Series  Includes plush figure,a
512,5258,3ed31e63edc7ea2874acc976023dc12e,White Mountain Puzzles General Store  1000 Piece Jigsaw Puzzle,Toys & Games ,5,$24.00,Old country store Lets go exploring on this crisp autumn day at a classic old country Emporium packed full of everything you could possibly need Enjoy the colorful General store jigsaw puzzle  1000Piece puzzle thrill and challenge your family and friends piecing together this incredible 1000Piece jigsaw puzzle Bring home hours of fun and of entertainment everyone will enjoy  About the artist Lewis T Johnsons versatile skills and experience coupled with passionate attention to detail color and design are key ingredients he puts into each and every puzzle he creates  More to puzzle building art jigsaw puzzles are a fun inexpensive way to enjoy works of art firsthand Use to boost valuable motor skills handeye coordination and problem solving skills  Specifics includes 1 000 extra large puzzle pieces made of sturdy blue chipboard on recycled paper Puzzle Dimensions completed 24 x 30 inches 100 customer satisfaction guarantee Made in USA,a
513,5465,50c208786e908cd56b6deb9a43ea5127,Sweet Jojo Designs 3Piece Bear Mountain Watercolor Boy FullQueen Kid Childrens Teen Bedding Comforter Set,Home & Kitchen ,1,$119.99,3 Piece Bedding Set 1 Lightweight FullQueen Comforter 2 Standard Shams  Dimensions Lightweight Comforter  FullQueen 86in x 86in Standard Shams 20in x 26in  This set combines a stunning bear and mountain watercolor print and a triangle tree print fabric  This set is made of brushed microfiber and is machine washable  This design has matching accessories such as window treatments hampers shower curtains and pillows,a
514,5092,b6cd2a308635f7e74d0ded67949e00fc,Ceaco Emoji Partytime Puzzle 300 Piece,Toys & Games ,4,$13.87,300 oversized pieces  Measures 19 inches x 19 inches when assembled  Promotes handeye coordination and problemsolving skills  Proudly made in the USA,a
515,5374,cada36e0aa06f7112ee9d4b8a927a04b,Kid Galaxy Remote Control Bumper Cars RC 2 Player Game 2 Cars and 2 Controllers Included,Toys & Games ,4,$59.99,All the fun of RC cars PLUS Interactive Play Race around and bump your opponent to disable their car  Lights keep score See how many bumps you need to win  Execute quick 360 degree spins to out maneuver your opponent Realistic sounds for thrilling Crash and Bash action  Easy to Use One control to go forward One control to turn Speed along on hardwood floors tile and medium carpet  Two Gifts for the Price of One Includes 2 RC cars and 2 remote controls Fully functional durable design for bumping Each RC toy operates independently Dimensions 75 x 4 x 35 inches For kids age 5 and up Batteries required 10 AAA 5 AAA per car not included,a
516,5035,0bd20123abf8264c64c829fddefcd75f,Amscan Party Supplies Multicolor,Toys & Games ,4,$8.37,30 notepads  Write down all your daily tasks and todos in this beautifully modern checklist notepads available in stars smiley and colorful circle designs  Party toy favor and prize giveaway  Perfect for arts and crafts time for parties or everyday fun activity,a
517,5198,5a2190ec98ca300eb6b3ae39a3d1b13b,Edupress Mathological Liar Game Grade 6 EP63399,Toys & Games ,2,$12.99,Includes 50 math mysteries  Set of 200 4 x 25 cards  directions  For 24 players,a
518,5251,cf6b14c946bfb8a6df1c5b05d60ced5b,Great Eastern GE7044 Ouran High School Host Club  15 Kumachan Bear Plush,Toys & Games ,4,$28.99,Officially Licensed by Great Eastern  Makes a great gift  Cute and Collectible  Limited availability  Approx Size 13L x 7W x 15H,a
519,5233,c9f38149cd0c59576905c321b265103a,Air Hogs 2in1 Hyper Drift Drone for High Speed Racing and Flying  Green,Toys & Games ,1,$29.99,Air Hogs Hyper Drift Drone is a 2in1 vehicle Race along the ground or fly through the sky at super fast speed with the detachable drone  Speed demons head to the race with Air Hogs Hyper Drift Drone Equipped with a turbo drone power source it is made for racing at breakneck speeds  The turbo drone is made with a selfrighting cage to ensure you land upright and are ready to lift off  even after an epic crash  Made for kids aged 8 Charges via USB 4Channel controller requires 2 x AAA batteries not included Charge for 30 minutes play for 7 minutes Recommended for indoor use Communication range of 200 ft and frequency of 24 GHz  Includes 1 Hyper Drift Drone 1 Controller 1 USB charger 1 Instruction sheet Spare propellers,a
520,5114,67e15b8448411e7979e97815894e194d,Learning Resources Jumbo Reptiles  Amphibians I Tortoise Gecko Snake Iguana and Tree Frog 5 Animals,Toys & Games ,2,$24.49,SPARK INTEREST IN SCIENCE Turn your childs natural fascination with into an early curiosity about the natural world with this educational reptile and amphibian set  ENCOURAGE Inspire imaginative play and curiosity This jumbo set is the perfect introduction to paleontology archeology history and a love of learning Activity guide gives simple animal facts and discussion starters to learn while playing  DURABLE FUN Made of lightweight durable dishwashersafe plastic  Educational toys for ages 3  Great for any toddler,a
521,5274,73ed26066a85038048c5fc8a331e5cef,Daron FDNY Ambulance with Lights  Sounds 2019 New,Toys & Games ,4,$14.99,Logo and Markings certified by the FDNY  Functional Lights  Sounds  Back door open and closes  Includes FDNY Stretcher,a
522,5303,d2b917cd9fbe4a9e80a6b8586d6d5204,Great Eastern Entertainment Dragon Ball Z  Goku vs Frieza Sublimation Beanie Headwear,Toys & Games ,4,$24.73,Fully licensed  Quality materials  Comfortable fitting,a
523,5586,6f97293a7ce6f78a3eaaf6eaaa3ea3d4,Tamiya Models M1A2 Abrams Model Kit,Toys & Games ,2,$43.00,Comes with Commander and loader half body figures  Parts used to reproduce Marine Corps version included  135 Scale Armor,a
524,5027,0bd50d3d0ec8094bb4692c8fb7008d84,Ravensburger The Saguenay Fjord Canadian Collection Canadienne 1000 Piece Jigsaw Puzzle for Adults  Every piece is unique Softclick technology Means Pieces Fit Together Perfectly,Toys & Games ,1,$19.40,Bestselling puzzle brand worldwide  With over 1 billion puzzles sold Ravensburger is the bestselling puzzle brand worldwide  What you get  1000 piece Ravensburger jigsaw puzzles for adults are crafted with premium quality in terms of both content and material and have a completed size of 27 x 20  AntiGlare surface  Ravensburger puzzles use an exclusively developed extrathick cardboard combined with our fine linen structured paper to create a glarefree puzzle image and give you the best experience possible  Every piece is unique  None of the frustrations you find with other puzzle brands With Ravensburger every individual piece has a completely unique shape  Makes a great gift  Puzzles are a fun activity to do alone or in a group and make a great gift for all ages at birthdays and holidays,a
525,5484,23cc6fae7c7e8d489417c54c4bc3b288,Marvel Legends Deadpools Rainbow Squad 5Pack,Toys & Games ,1,$22.70,5 figures with rainbow colored Deadpool design  20 accessories to imagine mercenary fun  Includes Deadpool figure and 4 Deadpool wannabe figures  Collect other figures from the Legends Series each sold separately  Includes 5 figures and 20 accessories,a
526,5230,9e36ec56b97e87c6e198d8f959f9a432,MightySkins Skin Compatible with Yuneec Q500  Q500 Quadcopter Drone wrap Cover Sticker Skins Bandana,Toys & Games ,2,$26.99,DECAL ONLY  Yuneec Q500  Q500 Not Included  Add style to your Yuneec Q500  Q500 Quadcopter Drone  Quick and easy to apply  Protect your Yuneec Q500  Q500 Quadcopter Drone from dings and scratches  PROUDLY MADE IN THE USA We Use Only 3M automotivegrade vinyl the industrys most trusted brand MightySkins are produced in our stateoftheart facility in West Palm Beach Florida,a
527,5477,b035f19e14382265040e3c8eaf37cfdb,Far From Home SpiderMan New Suit Child Mask,Toys & Games ,1,$7.99,Officially licensed in partnership with Marvel Comics look for Marvel and Rubies trademark on label and packaging to help insure youve receive authentic item  Enhance your SpiderMan costume with this red and black fabric mask  Important Costumes are sized differently than apparel use the Rubies Child Size Chart image do not choose based on Childs age or clothing size  Groups families create your own SpiderMan look with costumes from all your favorite movies  From movie Premieres to fan conventions And fun runs to Halloween whatever the reason or the season Rubies the worlds largest designer and manufacturer of costumes and accessories is pleased to offer you and your family The latest and most innovative concepts in Masquerade,a
528,5390,e90a33df4d9b1e018a14d688bff39092,Bright Starts Sesame Street Snack  Stroll Cookie Monster Wooden Pull Toy Ages 1236 Months,Toys & Games ,3,$10.99,Walk with Cookie Monster as he om nom noms cookies  Wooden toy grows with baby from crawling to walking  Pull toy introduces cause and effect fun  Toy for 1 year old helps baby practice balance and coordination,a
529,5045,71c46a2cdc047e2f4e72062a85c7ccbe,FisherPrice Classic Changeable Picture Disk Camera,Toys & Games ,1,$17.94,The iconic FisherPrice changeable disk camera  first introduced in 1968  Comes complete with 3 picture disks  Retro style toy camera,a
530,5373,2f1580c5ef760fa86deb9d4531ee21b3,BEYBLADE Burst Starter Pack Betromoth B2,Toys & Games ,4,$15.50,Can burst opponents tops in battle  Most Beyblade Burst components are interchangeable with other Beyblade Burst tops except Rip Fire tops  Burst rates vary  Only use Beyblade Burst tops with a Beyblade Burst Beystadium sold separately Subject to availability  Includes Beyblade Burst Energy Layer 1 Forge Disc 1 Performance Tip 1 launcher 1 and instructions,a
531,5338,ed40b96bb7ee7a0586c0e1461ebd72fe,PlayWheels Teenage Mutant Ninja Turtles Roller Skates with Knee Pads GreenBlue Junior Size 612,Sports & Outdoors ,5,$17.63,Adjustable roller skates and knee pad set that grows with your child  Convenient thumb screws allow for 2in adjustment from Junior Size 612 with no tools required  Toe brakes included on both skates for easy slowing or stopping  Impactresistant PVC knee caps ensure extra protection plus easy size adjusting with hook and loop straps  Recommended for ages 3 through 6 years weight capacity of 45 lbs,a
532,5493,d62b181f28e36fafe787b890ae215a9e,Creative Converting 8 Count HotCold Cups 9 oz Metallic Webs,Toys & Games ,4,$7.55,8Count package of package of hotcold paper cups  Holds 9 ounces of your favorite hot or cold beverage  Made in the USA  Gray spider webs on black background great for a Halloween party  Pair with Creative Converting tableware Haunted Night,a
533,5394,9daa8fdb5dccade00da2ac755c2f723d,Beados Season 7 Shopkins Ice Cream Truck,Toys & Games ,1,$19.99,Loads of storage and display areas for your Beados Shopkins  Includes 400 beads,a
534,5062,df6d0f507ec71574c08499b56beed9e2,7in1 Combo Game with Chess Ludo Chinese Checkers  More,Toys & Games ,3,$14.95,Includes 7 Different Games Chess Checkers Chinese checkers Ludo Backgammon Dominoes Tictactoe  Materials Wood and plastic Game boards and game pieces are selfcontained  Length 115 inches  Width 12 inches  Height 3 inches,a
535,5490,25b717ae71c8f05f08aaa053dec0cb1d,Disney 96959 Toy Story Ball Pit 1 Inflatable  15 SofFlex Balls,Toys & Games ,3,$22.12,Includes 15 soft flex balls  Toss balls into roof and watch them drop down into the ball pit  Peekthrough windows  For ages 2 and up,a
536,5064,cda1a975f31d901e2dc7901a75e5b917,Harry Potter Sorting Hat,"Clothing, Shoes & Jewelry ",1,$20.99,Synthetic  2 high  19 wide  OFFICIALLY LICENSED HARRY POTTER a trademark of Warner Bros Entertainment look for authentic logo on package and label to assure youve received a safetytested item  Brown fauxsuede pointed hat with wired brim attached patch accents hidden wire frame for support  ONE SIZE Designed to fit most children measures approximately 20inches tall and 23inches diameter at the base  Rubies has character costumes accessories and dcor in sizes and styles for the entire family  whether theyre in Gryffindor Slytherin Ravenclaw or Hufflepuff  Familyowned familyfocused and based in the USA since 1950 Rubies has classic and licensed costumes and accessories in sizes and styles for your entire family,a
537,5576,2f4971bbb84a457d8569c1c0bb98088b,The Puppet Company FullBodied Animal Hand Puppets Bear,Toys & Games ,3,$22.00,This beautiful fullbodied animal puppet has been designed to be as beautiful and cuddly as a soft toy but with all the functionality of a puppet  28 different animals in the range to collect from popular African beasts to farmyard favorites  Wonderful materials and shapes make these puppets highly desirable  Access into base of puppet  Suitable for children aged 12 months and above Average length 12,a
538,5071,b2888965b2eb97c91650669ae951765f,Rubies Mens Star Wars Collector Stormtrooper Collectors Helmet Multi One Size,"Clothing, Shoes & Jewelry ",2,$59.99,100 Plastic  Imported  Hand Wash  1575 high  1575 wide  Collectors Edition Star Wars Stormtrooper helmet  Injection molded for a superior look and feel  Wear with your favorite Star Wars costume or display at your home or office  Packaged in a collector box one size fits most adults  Officially licensed helmet is new and improved as of 2014,a
539,5581,6eb080a2fb050a168259b81c4085cbfb,DECOPAC Hot Wheels Drift DecoSet Cake Topper,Grocery & Gourmet Food ,3,$10.76,Food Grade Safe  2Piece Set  Set features a Hot Wheels track with a bright green car Car has wheels that turn and can be used as a toy after use as a cake decoration,a
540,5263,38ef557fcd34dd8be43120efebd0629f,Glitter Girls by Battat  Convertible Car for 14 Dolls  Toys Clothes  Accessories for Girls 3YearOld  Up Blue Orange Pink,Toys & Games ,1,$31.17,Convertible Car for 14inch 36 8cm dolls Dolls sold separately  Doors open steering wheel rotates wheels roll and gear shift moves  Secret storage compartments and builtin cupcake holder  Room in the trunk so your dolls can bring what they need on their journeys  Includes 1 convertible car  The dolls pictured are Candice Sashka Keltie and their puppy Pepper dolls and other accessories sold separately available on   Recommended for kids ages 3 and up  Collect all of your favorite Glitter Girls dolls outfits and accessories  Compatible with most 14inch dolls and accessories including Wellie Wishers and Hearts for Hearts  Certified free from BPA Phthalate and lead,a
541,5402,e2068e3b6d8566f0f4a175c26b65db3e,JumpSport SkyBounce Trampoline with Safety Enclosure  Includes Spring Pad,Sports & Outdoors ,3,$429.00,Ideal for younger children Provides a smooth forgiving bounce with a quality UV resistant pad  Doublebackup safety enclosure design with a zippered easyentry installation system Average installation time  25 hours  Reinforced Tjoint galvanized framing with our integrated UVresistant safety enclosure included  Meets ASTM Impact Performance Test standards Singleuser weight rating of 175 lbs real world testing to a combined weight of 400 lbs  Our familyowned company continues to deliver industry leading products are entirely designed  engineered in USA,a
542,5052,46df1381b7dccff517a272bdb4b727e5,DC Super Hero Girls Teen to Super Life Supergirl Doll,Toys & Games ,1,$9.76,Supergirl doll aka Kara Danvers comes with two complete looks transform her from superteen to Super Hero  Fans can play out every day Super Hero High stories or swoop into actionPacked play to save the day with this doll and 6 removable accessories  She comes dressed in her school outfit ready to rock in her ripped jeans boots belt and motor jacket  When duty calls change Kara Danvers into her iconic Supergirl uniform complete with a red cape skirt belt and sneakers  For storytelling fun she also comes with her signature guitar and skateboard  Doll approx105in can stand alone and has bendable joints at the elbows wrists and knees for actionPacked posing and play  For ages 6 and up,a
543,5069,5bef396827c8a7d0b2e1d0bdd698002b,Warmies Microwavable French Lavender Scented Plush Jr Clown Fish,Toys & Games ,3,$11.53,Fully microwavable plush soft toy that meets all US Safety standards for all ages  Filled with allnatural grain and dried French Lavender to provide soothing warmth and comfort  Manufactured with the highest quality super soft fabrics for over 20 years  Great stress relief bedtime buddy daytime friend Travel companion soothes tummy reduces anxiety great for colic relief and so comforting  Warmies are the 1 leading and trusted brand of hot and cold therapy plush toys and spa gifts,a
544,5118,5caaf089f37595fdc5333946fcd0c56e,Performance Tool W5220 200 pc Hex Washer Self Drilling Assortment,Industrial & Scientific ,5,$10.38,Contains 8 popular sizes  Convenient resealable plastic case  Useful parts kit for your shop,a
545,5224,9ba26b43016cba318f40cccb1a816d47,J Concepts 3377B Tribute 26x36 Monster Truck Wheels with Adaptors Black 1 Pair,Toys & Games ,3,$26.10,Onepiece scale size and width  Durable design and material  Includes multiple offset wheel adaptors  Closed and open planetary caps included  Complete installation hardware,a
546,5033,ce8029f5d8f4a4e0f99ae6187fae74b5,Dr Ph Martins Radiant Concentrated Water Color 05 oz Set of 14 Set B,"Arts, Crafts & Sewing ",2,$38.27,Set of 14 05 oz glass bottles with droppers and palette  Brilliant and highly concentrated color ideal for nearly any porous surface  Transparent watercolor dye for brush pen or airbrush  56 unique colors available across four different sets  Made in the USA,a
547,5082,75cee6637016dcdc96260946913551b1,Diamonsters,Toys & Games ,1,$12.40,For ages 10 and up  2 to 6 players  20 minutes playtime,a
548,5077,0a369def7c5324420c12d74ee0bb0b1c,Janlynn Cool Cord Friendship Bracelet Pack Makes 100 Bracelets,Toys & Games ,1,$19.99,Create beautiful works  Includes all supplies  Detailed instructions,a
